resolution_id,source_type,identifier_type,series_id,series_name,family_name,filer_cik,filer_name,inst_parent_name,report_month_count,total_nav,candidate_entity_count,candidate_names,pending_since,decision
4326,NPORT,series_id,S000083030,Federated Hermes Total Return Bond ETF,Federated Hermes ETF Trust,0001849998,,,1,355271689.45999986,0,,2026-04-15 08:10:18.206341,
631,NPORT,series_id,1815609_0000910472-25-004191,PRIMARK MEKETA PRIVATE EQUITY INVESTMENTS FUND,Primark Meketa Private Equity Investments Fund,0001815609,,,1,354974163.19,0,,2026-04-15 08:10:18.206341,
1005,NPORT,series_id,65433_0001398344-26-005434,Mexico Fund Inc,MEXICO FUND INC,0000065433,,,1,354917084.71000004,0,,2026-04-15 08:10:18.206341,
824,NPORT,series_id,1991706_0001410368-26-021560,"Partners Group Growth, LLC","Partners Group Growth, LLC",0001991706,,,1,348971213.84,0,,2026-04-15 08:10:18.206341,
1715,NPORT,series_id,S000010876,AB Corporate Income Shares,AB CORPORATE SHARES,0001274676,,,2,348747065.3100001,0,,2026-04-15 08:10:18.206341,
1659,NPORT,series_id,S000009087,Federated Hermes Adjustable Rate Fund,Federated Hermes Adjustable Rate Securities Trust,0000771524,,,1,348584268.05000013,0,,2026-04-15 08:10:18.206341,
487,NPORT,series_id,1702885_0001193125-26-080875,NB Crossroads Private Markets Fund V Holdings LP,NB Crossroads Private Markets Fund V Holdings LP,0001702885,,,1,348350366.663525,0,,2026-04-15 08:10:18.206341,
239,NPORT,series_id,1338561_0001338561-26-000004,Nuveen S&P 500 Dynamic Overwrite Fund,Nuveen S&P 500 Dynamic Overwrite Fund,0001338561,,,1,348237777.4400004,0,,2026-04-15 08:10:18.206341,
1089,NPORT,series_id,846676_0001410368-26-020674,"abrdn Emerging Markets ex-China Fund, Inc.","abrdn Emerging Markets ex-China Fund, Inc.",0000846676,,,1,346530626.08,0,,2026-04-15 08:10:18.206341,
25,NPORT,series_id,1059213_0000910472-25-003329,BEXIL INVESTMENT TRUST,Bexil Investment Trust,0001059213,,,1,346218580.19,0,,2026-04-15 08:10:18.206341,
62,NPORT,series_id,1158289_0001158289-26-000004,Nuveen Real Estate Income Fund,Nuveen Real Estate Income Fund,0001158289,,,1,343589756.24999994,0,,2026-04-15 08:10:18.206341,
926,NPORT,series_id,2040318_0000940400-26-008524,Capital Group KKR Multi-Sector (plus),Capital Group KKR Multi-Sector (plus),0002040318,,,1,343441878.1300002,0,,2026-04-15 08:10:18.206341,
536,NPORT,series_id,1742837_0001193125-26-080870,NB Crossroads Private Markets Fund VI LP,NB Crossroads Private Markets Fund VI LP,0001742837,,,1,343217432.04,0,,2026-04-15 08:10:18.206341,
956,NPORT,series_id,2051511_0000894189-26-006705,Oaktree Asset-Backed Income Fund Inc.,Oaktree Asset-Backed Income Fund Inc.,0002051511,,,1,341473196.62,0,,2026-04-15 08:10:18.206341,
535,NPORT,series_id,1742837_0001193125-25-301958,NB Crossroads Private Markets Fund VI LP,NB Crossroads Private Markets Fund VI LP,0001742837,,,1,341208627.2099,0,,2026-04-15 08:10:18.206341,
1024,NPORT,series_id,801961_0001410368-26-032772,MFS MUNICIPAL INCOME TRUST,MFS MUNICIPAL INCOME TRUST,0000801961,,,1,340816288.3699998,0,,2026-04-15 08:10:18.206341,
1023,NPORT,series_id,801961_0001410368-25-041603,MFS MUNICIPAL INCOME TRUST,MFS MUNICIPAL INCOME TRUST,0000801961,,,1,339686243.3199998,0,,2026-04-15 08:10:18.206341,
1511,NPORT,series_id,S000005797,Hawaii Municipal Bond Fund,BISHOP STREET FUNDS,0000925737,,,2,339078972.02000004,0,,2026-04-15 08:10:18.206341,
841,NPORT,series_id,2001586_0001049169-26-000683,"CION Grosvenor Infrastructure Master Fund, LLC","CION Grosvenor Infrastructure Master Fund, LLC",0002001586,,,1,338689994.74,0,,2026-04-15 08:10:18.206341,
470,NPORT,series_id,1678130_0001049169-26-000382,RiverNorth/DoubleLine Strategic Opportunity Fund Inc.,RIVERNORTH/DOUBLELINE STRATEGIC OPPORTUNITY FUND INC.,0001678130,,,1,335682221.590001,1,"RiverNorth/DoubleLine Strategic Opportunity Fund, Inc.  (OPP, OPP-PA, OPP-PB)",2026-04-15 08:10:18.206341,
394,NPORT,series_id,1565381_0000940400-26-002279,"BNY Mellon Municipal Bond Infrastructure Fund, Inc.","BNY Mellon Municipal Bond Infrastructure Fund, Inc.",0001565381,,,1,334982793.25499994,0,,2026-04-15 08:10:18.206341,
188,NPORT,series_id,1282850_0000940400-25-005551,First Trust Senior Floating Rate Income Fund II,First Trust Senior Floating Rate Income Fund II,0001282850,,,1,334869713.62000006,0,,2026-04-15 08:10:18.206341,
266,NPORT,series_id,1386067_0001410368-26-032009,ALLSPRING GLOBAL DIVIDEND OPPORTUNITY FUND,ALLSPRING GLOBAL DIVIDEND OPPORTUNITY FUND,0001386067,,,1,334771903.27999985,0,,2026-04-15 08:10:18.206341,
307,NPORT,series_id,1487610_0001410368-25-042416,Neuberger Berman High Yield Strategies Fund Inc.,Neuberger Berman High Yield Strategies Fund Inc.,0001487610,,,1,333632180.0399999,0,,2026-04-15 08:10:18.206341,
1099,NPORT,series_id,859796_0001003715-26-000150,"Japan Smaller Capitalization Fund, Inc.","Japan Smaller Capitalization Fund, Inc.",0000859796,,,1,330792234.2000001,0,,2026-04-15 08:10:18.206341,
41,NPORT,series_id,1080720_0000940400-25-012093,Gabelli Utility Trust,Gabelli Utility Trust,0001080720,,,1,330625283.10999995,0,,2026-04-15 08:10:18.206341,
2609,NPORT,series_id,S000055516,FlexShares Core Select Bond Fund,FlexShares Trust,0001491978,,,2,328332774.89000005,0,,2026-04-15 08:10:18.206341,
249,NPORT,series_id,1368493_0001410368-26-018437,"Morgan Stanley China A Share Fund, Inc.","Morgan Stanley China A Share Fund, Inc.",0001368493,,,1,327242171.55,0,,2026-04-15 08:10:18.206341,
308,NPORT,series_id,1487610_0001410368-26-029177,Neuberger High Yield Strategies Fund Inc.,Neuberger High Yield Strategies Fund Inc.,0001487610,,,1,326898890.33000016,0,,2026-04-15 08:10:18.206341,
265,NPORT,series_id,1386067_0001410368-25-041029,ALLSPRING GLOBAL DIVIDEND OPPORTUNITY FUND,ALLSPRING GLOBAL DIVIDEND OPPORTUNITY FUND,0001386067,,,1,325980634.9200002,0,,2026-04-15 08:10:18.206341,
1184,NPORT,series_id,919893_0002071691-26-003945,"Templeton Dragon Fund, Inc.","Templeton Dragon Fund, Inc.",0000919893,,,1,325584563.28,0,,2026-04-15 08:10:18.206341,
358,NPORT,series_id,1525201_0001193125-25-296892,DoubleLine Opportunistic Credit Fund,DoubleLine Opportunistic Credit Fund,0001525201,,,1,324502879.2,0,,2026-04-15 08:10:18.206341,
29,NPORT,series_id,1061353_0001410368-25-043608,CREDIT SUISSE HIGH YIELD CREDIT FUND,CREDIT SUISSE HIGH YIELD CREDIT FUND,0001061353,,,1,323538407.27999985,0,,2026-04-15 08:10:18.206341,
972,NPORT,series_id,2061233_0000910472-25-005417,Morgan Stanley Private Markets & Alternative Fund,Morgan Stanley Private Markets and Alternatives,0002061233,,,1,323043191.24,0,,2026-04-15 08:10:18.206341,
887,NPORT,series_id,2023164_0000910472-26-000846,Booster Income Opportunities Fund,Booster Income Opportunities Fund,0002023164,,,1,322363048.77,0,,2026-04-15 08:10:18.206341,
1346,NPORT,series_id,S000002663,Series M,SMA RELATIONSHIP TRUST,0001225290,,,1,322362731.7900001,0,,2026-04-15 08:10:18.206341,
645,NPORT,series_id,1826222_0001049169-26-000733,CPG Vintage Access Fund IV LLC,CPG Vintage Access Fund IV LLC,0001826222,,,1,321834821.07,0,,2026-04-15 08:10:18.206341,
1088,NPORT,series_id,846676_0001410368-25-032516,"abrdn Emerging Markets ex-China Fund, Inc.","abrdn Emerging Markets ex-China Fund, Inc.",0000846676,,,1,320522444.2900002,0,,2026-04-15 08:10:18.206341,
359,NPORT,series_id,1525201_0001193125-26-075564,DoubleLine Opportunistic Credit Fund,DoubleLine Opportunistic Credit Fund,0001525201,,,1,320278879.39999986,0,,2026-04-15 08:10:18.206341,
290,NPORT,series_id,1454741_0001410368-26-020609,Eaton Vance National Municipal Opportunities Trust,Eaton Vance National Municipal Opportunities Trust,0001454741,,,1,319881373.23999983,0,,2026-04-15 08:10:18.206341,
2638,NPORT,series_id,S000056657,Saba Closed-End Funds ETF,Exchange Listed Funds Trust,0001547950,,,1,319449223.09,0,,2026-04-15 08:10:18.206341,
42,NPORT,series_id,1080720_0000940400-26-009524,Gabelli Utility Trust,Gabelli Utility Trust,0001080720,,,1,319139476.2900001,0,,2026-04-15 08:10:18.206341,
692,NPORT,series_id,1854919_0000910472-25-005260,Dynamic Alternatives Fund,Dynamic Alternatives Fund,0001854919,,,1,319033330.15999997,0,,2026-04-15 08:10:18.206341,
1071,NPORT,series_id,832327_0001410368-25-032183,"BlackRock Income Trust, Inc.","BlackRock Income Trust, Inc.",0000832327,,,1,318902272.78999996,0,,2026-04-15 08:10:18.206341,
189,NPORT,series_id,1282850_0000940400-26-002446,First Trust Senior Floating Rate Income Fund II,First Trust Senior Floating Rate Income Fund II,0001282850,,,1,318687127.66999984,0,,2026-04-15 08:10:18.206341,
1004,NPORT,series_id,65433_0001398344-25-022706,Mexico Fund Inc,MEXICO FUND INC,0000065433,,,1,317808740.87000006,0,,2026-04-15 08:10:18.206341,
823,NPORT,series_id,1991706_0001410368-25-032776,"Partners Group Growth, LLC","Partners Group Growth, LLC",0001991706,,,1,317293303.48000014,0,,2026-04-15 08:10:18.206341,
146,NPORT,series_id,1245648_0000940400-26-002064,Flaherty & Crumrine Total Return Fund Incorporated,Flaherty & Crumrine Total Return Fund Inc,0001245648,,,1,315392526.7299998,0,,2026-04-15 08:10:18.206341,
462,NPORT,series_id,1669382_0001193125-25-301953,NB Crossroads Private Markets Fund IV Holdings LLC,NB Crossroads Private Markets Fund IV Holdings LLC,0001669382,,,1,312005554.38755125,0,,2026-04-15 08:10:18.206341,
925,NPORT,series_id,2040318_0000940400-25-011732,Capital Group KKR Multi-Sector (plus),Capital Group KKR Multi-Sector (plus),0002040318,,,1,311888949.01,0,,2026-04-15 08:10:18.206341,
30,NPORT,series_id,1061353_0001410368-26-034199,CREDIT SUISSE HIGH YIELD CREDIT FUND,CREDIT SUISSE HIGH YIELD CREDIT FUND,0001061353,,,1,311325600.96,0,,2026-04-15 08:10:18.206341,
83,NPORT,series_id,1170311_0001099263-26-003069,PIMCO New York Municipal Income Fund II,PIMCO New York Municipal Income Fund II,0001170311,,,1,310740717.47000015,0,,2026-04-15 08:10:18.206341,
1147,NPORT,series_id,891290_0001410368-25-032598,COHEN & STEERS TOTAL RETURN REALTY FUND INC,COHEN & STEERS TOTAL RETURN REALTY FUND INC,0000891290,,,1,310213602.9600001,0,,2026-04-15 08:10:18.206341,
4682,NPORT,series_id,S000085754,Federated Hermes MDT Large Cap Growth ETF,Federated Hermes ETF Trust,0001849998,,,1,309741632.14,0,,2026-04-15 08:10:18.206341,
4780,NPORT,series_id,S000086526,Eventide High Dividend ETF,Strategy Shares,0001506213,,,2,309367000.0700002,0,,2026-04-15 08:10:18.206341,
644,NPORT,series_id,1826222_0001049169-25-000984,CPG Vintage Access Fund IV LLC,CPG Vintage Access Fund IV LLC,0001826222,,,1,309335668.21,0,,2026-04-15 08:10:18.206341,
438,NPORT,series_id,1622148_0002048251-25-002963,Highland Global Allocation Fund,HIGHLAND GLOBAL ALLOCATION FUND,0001622148,,,1,308906189.5900001,0,,2026-04-15 08:10:18.206341,
1057,NPORT,series_id,826735_0001410368-25-041601,MFS INTERMEDIATE INCOME TRUST,MFS INTERMEDIATE INCOME TRUST,0000826735,,,1,308024468.5799998,0,,2026-04-15 08:10:18.206341,
439,NPORT,series_id,1622148_0002048251-26-001893,Highland Global Allocation Fund,HIGHLAND GLOBAL ALLOCATION FUND,0001622148,,,1,305906417.65000004,0,,2026-04-15 08:10:18.206341,
26,NPORT,series_id,1059213_0000910472-26-002192,BEXIL INVESTMENT TRUST,Bexil Investment Trust,0001059213,,,1,305730636.48,0,,2026-04-15 08:10:18.206341,
1058,NPORT,series_id,826735_0001410368-26-032769,MFS INTERMEDIATE INCOME TRUST,MFS INTERMEDIATE INCOME TRUST,0000826735,,,1,304393660.59999985,0,,2026-04-15 08:10:18.206341,
1152,NPORT,series_id,895528_0000895528-26-000004,Invesco Pennsylvania Value Municipal Income Trust,Invesco Pennsylvania Value Municipal Income Trust,0000895528,,,1,303528177.6099999,0,,2026-04-15 08:10:18.206341,
82,NPORT,series_id,1170311_0001099263-25-004533,PIMCO New York Municipal Income Fund II,PIMCO New York Municipal Income Fund II,0001170311,,,1,302994056.11000025,0,,2026-04-15 08:10:18.206341,
840,NPORT,series_id,2001586_0001049169-25-000909,"CION Grosvenor Infrastructure Master Fund, LLC","CION Grosvenor Infrastructure Master Fund, LLC",0002001586,,,1,302903208.80999994,0,,2026-04-15 08:10:18.206341,
1050,NPORT,series_id,818851_0000818851-26-000002,Nuveen California Municipal Value Fund,Nuveen California Municipal Value Fund,0000818851,,,1,300956718.8299999,0,,2026-04-15 08:10:18.206341,
2383,NPORT,series_id,S000045948,EUBEL BRADY & SUTTMAN INCOME AND APPRECIATION FUND,Eubel Brady & Suttman Mutual Fund Trust,0001606378,,,2,300498313.40999997,0,,2026-04-15 08:10:18.206341,
1178,NPORT,series_id,916618_0001410368-26-018470,"MORGAN STANLEY INDIA INVESTMENT FUND, INC.","MORGAN STANLEY INDIA INVESTMENT FUND, INC.",0000916618,,,1,300149950.69999987,0,,2026-04-15 08:10:18.206341,
248,NPORT,series_id,1362481_0001410368-26-029985,abrdn Global Dynamic Dividend Fund,abrdn Global Dynamic Dividend Fund,0001362481,,,1,299830361.6999999,0,,2026-04-15 08:10:18.206341,
563,NPORT,series_id,1767074_0000910472-25-005232,CIM Real Assets & Credit Fund,CIM Real Assets & Credit Fund,0001767074,,,1,298963029.88,0,,2026-04-15 08:10:18.206341,
701,NPORT,series_id,1860151_0001860151-26-000004,Invesco Dynamic Credit Opportunity Fund,Invesco Dynamic Credit Opportunity Fund,0001860151,,,1,297524672.02000004,0,,2026-04-15 08:10:18.206341,
463,NPORT,series_id,1669382_0001193125-26-080881,NB Crossroads Private Markets Fund IV Holdings LLC,NB Crossroads Private Markets Fund IV Holdings LLC,0001669382,,,1,297271898.63927495,0,,2026-04-15 08:10:18.206341,
1177,NPORT,series_id,916618_0001410368-25-031664,"MORGAN STANLEY INDIA INVESTMENT FUND, INC.","MORGAN STANLEY INDIA INVESTMENT FUND, INC.",0000916618,,,1,297031360.99999994,0,,2026-04-15 08:10:18.206341,
933,NPORT,series_id,2041398_0001193125-26-083049,Hamilton Lane Private Secondary Fund,Hamilton Lane Private Secondary Fund,0002041398,,,1,296650918.12000006,0,,2026-04-15 08:10:18.206341,
934,NPORT,series_id,2041398_0001193125-26-083059,Hamilton Lane Private Secondary Fund,Hamilton Lane Private Secondary Fund,0002041398,,,1,296650918.1199999,0,,2026-04-15 08:10:18.206341,
1148,NPORT,series_id,891290_0001410368-26-019356,COHEN & STEERS TOTAL RETURN REALTY FUND INC,COHEN & STEERS TOTAL RETURN REALTY FUND INC,0000891290,,,1,295836836.6800002,0,,2026-04-15 08:10:18.206341,
338,NPORT,series_id,1506707_0001193125-26-066284,A&Q Multi-Strategy Fund,A&Q Multi-Strategy Fund,0001506707,,,1,295298760.5499999,0,,2026-04-15 08:10:18.206341,
1036,NPORT,series_id,809708_0002071691-26-001207,Templeton Emerging Markets Fund,Templeton Emerging Markets Fund,0000809708,,,1,294256944.81999993,0,,2026-04-15 08:10:18.206341,
3320,NPORT,series_id,S000070448,Strategy Shares Gold Enhanced Yield ETF,Strategy Shares,0001506213,,,2,293269180.98999995,0,,2026-04-15 08:10:18.206341,
247,NPORT,series_id,1362481_0001410368-25-042509,abrdn Global Dynamic Dividend Fund,abrdn Global Dynamic Dividend Fund,0001362481,,,1,292704316.70000005,0,,2026-04-15 08:10:18.206341,
781,NPORT,series_id,1944664_0000910472-25-004726,Nomura Alternative Income Fund,Nomura Alternative Income Fund,0001944664,,,1,292208646.41,0,,2026-04-15 08:10:18.206341,
5058,NPORT,series_id,S000089221,Thornburg International Equity ETF,Thornburg ETF Trust,0002038383,,,1,291439505.81,0,,2026-04-15 08:10:18.206341,
700,NPORT,series_id,1860151_0001860151-25-000005,Invesco Dynamic Credit Opportunity Fund,Invesco Dynamic Credit Opportunity Fund,0001860151,,,1,291299095.1900002,0,,2026-04-15 08:10:18.206341,
288,NPORT,series_id,1450445_0001450445-25-000009,Nuveen AMT-Free Municipal Value Fund,Nuveen AMT-Free Municipal Value Fund,0001450445,,,1,290684895.75,0,,2026-04-15 08:10:18.206341,
1054,NPORT,series_id,825202_0001410368-26-017155,SPROTT FOCUS TRUST INC.,SPROTT FOCUS TRUST INC.,0000825202,,,1,290638054.64,0,,2026-04-15 08:10:18.206341,
1049,NPORT,series_id,818851_0000818851-25-000005,Nuveen California Municipal Value Fund,Nuveen California Municipal Value Fund,0000818851,,,1,290198957.13999987,0,,2026-04-15 08:10:18.206341,
289,NPORT,series_id,1450445_0001450445-26-000006,Nuveen AMT-Free Municipal Value Fund,Nuveen AMT-Free Municipal Value Fund,0001450445,,,1,289994833.28000003,0,,2026-04-15 08:10:18.206341,
264,NPORT,series_id,1385763_0001385763-26-000004,Nuveen Core Equity Alpha Fund,Nuveen Core Equity Alpha Fund,0001385763,,,1,287881287.46,0,,2026-04-15 08:10:18.206341,
263,NPORT,series_id,1385763_0001385763-25-000007,Nuveen Core Equity Alpha Fund,Nuveen Core Equity Alpha Fund,0001385763,,,1,285675357.3200001,0,,2026-04-15 08:10:18.206341,
940,NPORT,series_id,2042256_0000910472-26-003682,iDirect Private Credit Fund,iDirect Private Credit Fund,0002042256,,,1,284906846.2300001,0,,2026-04-15 08:10:18.206341,
725,NPORT,series_id,1875084_0000940400-26-008923,"PGIM Private Real Estate Fund, Inc.","PGIM Private Real Estate Fund, Inc.",0001875084,,,1,284001604.21000004,0,,2026-04-15 08:10:18.206341,
527,NPORT,series_id,1737936_0002048251-25-001294,City National Rochdale Strategic Credit Fund,City National Rochdale Strategic Credit Fund,0001737936,,,1,282973697.1,0,,2026-04-15 08:10:18.206341,
3489,NPORT,series_id,S000072763,MassMutual Global Credit Income Opportunities Fund,MassMutual Advantage Funds,0001859808,,,2,281507133.39999986,0,,2026-04-15 08:10:18.206341,
245,NPORT,series_id,1350869_0001350869-25-000008,Clough Global Opportunities Fund,CLOUGH GLOBAL OPPORTUNITIES FUND,0001350869,,,1,281261873.24,0,,2026-04-15 08:10:18.206341,
246,NPORT,series_id,1350869_0001350869-26-000009,Clough Global Opportunities Fund,CLOUGH GLOBAL OPPORTUNITIES FUND,0001350869,,,1,280753724.88000005,0,,2026-04-15 08:10:18.206341,
1034,NPORT,series_id,809559_0001410368-25-022020,TCW STRATEGIC INCOME FUND INC,TCW STRATEGIC INCOME FUND INC,0000809559,,,1,279311505.9999998,0,,2026-04-15 08:10:18.206341,
663,NPORT,series_id,1843499_0001193125-26-133654,AFA Asset Based Lending Fund,AFA Asset Based Lending Fund,0001843499,,,1,278727135.47999996,0,,2026-04-15 08:10:18.206341,
306,NPORT,series_id,1486298_0001049169-26-000323,Blackstone Senior Floating Rate 2027 Term Fund,Blackstone Senior Floating Rate 2027 Term Fund,0001486298,,,1,278581166.98999995,0,,2026-04-15 08:10:18.206341,
8,NPORT,series_id,1011006_0001193125-26-071647,Altaba Inc.,Altaba Inc.,0001011006,,,1,278417133.94,0,,2026-04-15 08:10:18.206341,
1074,NPORT,series_id,833040_0002071691-26-001204,Franklin Universal Trust,Franklin Universal Trust,0000833040,,,1,278389880.28000003,0,,2026-04-15 08:10:18.206341,
951,NPORT,series_id,2047442_0001410368-26-020624,Calamos Aksia Private Equity & Alternatives Fund,Calamos Aksia Private Equity & Alternatives Fund,0002047442,,,1,278245383.13,0,,2026-04-15 08:10:18.206341,
662,NPORT,series_id,1843499_0001193125-25-330034,AFA Asset Based Lending Fund,AFA Asset Based Lending Fund,0001843499,,,1,277884563.74,0,,2026-04-15 08:10:18.206341,
7,NPORT,series_id,1011006_0001193125-25-274324,Altaba Inc.,Altaba Inc.,0001011006,,,1,277623357.19,0,,2026-04-15 08:10:18.206341,
1053,NPORT,series_id,825202_0001410368-25-029098,SPROTT FOCUS TRUST INC.,SPROTT FOCUS TRUST INC.,0000825202,,,1,277546913.77000004,0,,2026-04-15 08:10:18.206341,
161,NPORT,series_id,1261166_0001410368-25-042420,NEUBERGER BERMAN REAL ESTATE SECURITIES INCOME FUND INC,NEUBERGER BERMAN REAL ESTATE SECURITIES INCOME FUND INC,0001261166,,,1,276604114.29,0,,2026-04-15 08:10:18.206341,
305,NPORT,series_id,1486298_0001049169-25-000900,Blackstone Senior Floating Rate 2027 Term Fund,Blackstone Senior Floating Rate 2027 Term Fund,0001486298,,,1,276482205.7099998,0,,2026-04-15 08:10:18.206341,
138,NPORT,series_id,1228509_0000940400-26-002006,Western Asset Global High Income Fund Inc.,Western Asset Global High Income Fund Inc.,0001228509,,,1,275738006.1500001,0,,2026-04-15 08:10:18.206341,
21,NPORT,series_id,1057861_0000940400-25-010191,BNY Mellon High Yield Strategies Fund,BNY Mellon High Yield Strategies Fund,0001057861,,,1,274872723.3099999,0,,2026-04-15 08:10:18.206341,
564,NPORT,series_id,1767074_0000910472-26-003598,CIM Real Assets & Credit Fund,CIM Real Assets & Credit Fund,0001767074,,,1,274373025.4,0,,2026-04-15 08:10:18.206341,
950,NPORT,series_id,2046200_0000940400-26-009019,"AMG Pantheon Infrastructure Fund, LLC","AMG Pantheon Infrastructure Fund, LLC",0002046200,,,1,274351151.42,0,,2026-04-15 08:10:18.206341,
599,NPORT,series_id,1796242_0000940400-26-007868,Goldman Sachs Real Estate Diversified Income Fund,Goldman Sachs Real Estate Diversified Income Fund,0001796242,,,1,274025250.1799999,0,,2026-04-15 08:10:18.206341,
939,NPORT,series_id,2042256_0000910472-25-005419,iDirect Private Credit Fund,iDirect Private Credit Fund,0002042256,,,1,273927058.79999995,0,,2026-04-15 08:10:18.206341,
1035,NPORT,series_id,809559_0001410368-26-019026,TCW STRATEGIC INCOME FUND INC,TCW STRATEGIC INCOME FUND INC,0000809559,,,1,273903612.3300002,0,,2026-04-15 08:10:18.206341,
162,NPORT,series_id,1261166_0001410368-26-029181,NEUBERGER REAL ESTATE SECURITIES INCOME FUND INC,NEUBERGER REAL ESTATE SECURITIES INCOME FUND INC,0001261166,,,1,273407954.00000006,0,,2026-04-15 08:10:18.206341,
22,NPORT,series_id,1057861_0000940400-26-007867,BNY Mellon High Yield Strategies Fund,BNY Mellon High Yield Strategies Fund,0001057861,,,1,272467413.19999975,0,,2026-04-15 08:10:18.206341,
724,NPORT,series_id,1875084_0000940400-25-011186,"PGIM Private Real Estate Fund, Inc.","PGIM Private Real Estate Fund, Inc.",0001875084,,,1,269991811.53,0,,2026-04-15 08:10:18.206341,
3277,NPORT,series_id,S000070062,The E-Valuator Growth (70%-85%) RMS Fund,E-Valuator Funds Trust,0001821505,,,1,269747917.51,0,,2026-04-15 08:10:18.206341,
976,NPORT,series_id,2063946_0000940400-26-007262,Franklin BSP Lending Fund,Franklin BSP Lending Fund,0002063946,,,1,268662972.5400001,0,,2026-04-15 08:10:18.206341,
474,NPORT,series_id,1682662_0000910472-26-004417,Peachtree Alternative Strategies Fund,Peachtree Alternative Strategies Fund,0001682662,,,1,268066008.05999994,0,,2026-04-15 08:10:18.206341,
962,NPORT,series_id,2054992_0001410368-26-018300,Lincoln Bain Capital Total Credit Fund,Lincoln Bain Capital Total Credit Fund,0002054992,,,1,266732327.92999998,0,,2026-04-15 08:10:18.206341,
5092,NPORT,series_id,S000089355,Eventide US Market ETF,Strategy Shares,0001506213,,,2,264261583.60000002,0,,2026-04-15 08:10:18.206341,
2507,NPORT,series_id,S000052299,ARK Israel Innovative Technology ETF,ARK ETF Trust,0001579982,,,2,264114814.28999984,0,,2026-04-15 08:10:18.206341,
180,NPORT,series_id,1278211_0001410368-26-021465,LAZARD GLOBAL TOTAL RETURN & INCOME FUND INC,LAZARD GLOBAL TOTAL RETURN & INCOME FUND INC,0001278211,,,1,262931732.48999995,0,,2026-04-15 08:10:18.206341,
736,NPORT,series_id,1885778_0001885778-26-000006,John Hancock Marathon Asset-Based Lending Fund,John Hancock Marathon Asset-Based Lending Fund,0001885778,,,1,261496177.7200001,0,,2026-04-15 08:10:18.206341,
1146,NPORT,series_id,891038_0001410368-26-031745,BlackRock MuniYield Pennsylvania Quality Fund,BlackRock MuniYield Pennsylvania Quality Fund,0000891038,,,1,260986770.85999995,0,,2026-04-15 08:10:18.206341,
1145,NPORT,series_id,891038_0001410368-25-043481,BlackRock MuniYield Pennsylvania Quality Fund,BlackRock MuniYield Pennsylvania Quality Fund,0000891038,,,1,260833301.95000008,0,,2026-04-15 08:10:18.206341,
528,NPORT,series_id,1737936_0002048251-26-000746,City National Rochdale Strategic Credit Fund,City National Rochdale Strategic Credit Fund,0001737936,,,1,260542791.53,0,,2026-04-15 08:10:18.206341,
3545,NPORT,series_id,S000073803,Miller Market Neutral Income Fund,Miller Investment Trust,0001414039,,,2,260352164.70999992,0,,2026-04-15 08:10:18.206341,
473,NPORT,series_id,1682662_0000910472-25-006341,Peachtree Alternative Strategies Fund,Peachtree Alternative Strategies Fund,0001682662,,,1,260142335.29000005,0,,2026-04-15 08:10:18.206341,
279,NPORT,series_id,1400897_0000894189-26-002926,NXG Cushing Midstream Energy Fund,NXG Cushing Midstream Energy Fund,0001400897,,,1,259100188.05,0,,2026-04-15 08:10:18.206341,
1700,NPORT,series_id,S000010355,AB Massachusetts Portfolio,AB MUNICIPAL INCOME FUND II,0000899774,,,1,257625211.44000006,0,,2026-04-15 08:10:18.206341,
652,NPORT,series_id,1832871_0001410368-26-016970,BlackRock 2037 Municipal Target Term Trust,BlackRock 2037 Municipal Target Term Trust,0001832871,,,1,257415408.73,0,,2026-04-15 08:10:18.206341,
510,NPORT,series_id,1716951_0001398344-25-022267,"OFS Credit Company, Inc.","OFS Credit Company, Inc.",0001716951,,,1,256537116.83999994,0,,2026-04-15 08:10:18.206341,
1721,NPORT,series_id,S000011440,NORTHEAST INVESTORS TRUST,NORTHEAST INVESTORS TRUST,0000072760,,,2,256314409.78128004,0,,2026-04-15 08:10:18.206341,
1302,NPORT,series_id,S000002415,Nomura Tax-Free Idaho Fund,Voyageur Mutual Funds,0000906236,,,2,255331166.29000008,0,,2026-04-15 08:10:18.206341,
2371,NPORT,series_id,S000045497,Guggenheim Strategy Fund III,Guggenheim Strategy Funds Trust,0001601445,,,2,252847752.4,0,,2026-04-15 08:10:18.206341,
819,NPORT,series_id,1989393_0001410368-26-021559,Partners Group Next Generation Infrastructure LLC,Partners Group Next Generation Infrastructure LLC,0001989393,,,1,252582491.63999996,0,,2026-04-15 08:10:18.206341,
4974,NPORT,series_id,S000088548,GMO International Quality ETF,GMO ETF Trust,0001981627,,,1,252496682.15000007,0,,2026-04-15 08:10:18.206341,
900,NPORT,series_id,2028436_0001410368-26-021414,T. Rowe Price OHA Flexible Credit Income Fund,T. Rowe Price OHA Flexible Credit Income Fund,0002028436,,,1,252128619.68999997,0,,2026-04-15 08:10:18.206341,
1105,NPORT,series_id,868578_0000940400-26-002054,Flaherty & Crumrine Preferred and Income Fund Incorporated,Flaherty & Crumrine Preferred & Income Fund Inc,0000868578,,,1,251826796.38999987,0,,2026-04-15 08:10:18.206341,
334,NPORT,series_id,1504545_0000940400-25-013950,BrandywineGLOBAL-Global Income Opportunities Fund Inc,BrandywineGLOBAL-Global Income Opportunities Fund Inc,0001504545,,,1,250785584.63999993,0,,2026-04-15 08:10:18.206341,
