resolution_id,source_type,identifier_type,series_id,series_name,family_name,filer_cik,filer_name,inst_parent_name,report_month_count,total_nav,candidate_entity_count,candidate_names,pending_since,decision
913,NPORT,series_id,2035632_0002035632-26-000006,John Hancock CQS Asset Backed Securities Fund,John Hancock CQS Asset Backed Securities Fund,0002035632,,,1,103692766.05000006,0,,2026-04-15 08:10:18.206341,
620,NPORT,series_id,1807334_0002048251-26-001437,Wilshire Private Assets Fund,Wilshire Private Assets Fund,0001807334,,,1,103596071.17999999,0,,2026-04-15 08:10:18.206341,
607,NPORT,series_id,1807333_0002048251-26-001438,Wilshire Private Assets Master Fund,Wilshire Private Assets Master Fund,0001807333,,,1,103538970.82000002,0,,2026-04-15 08:10:18.206341,
4306,NPORT,series_id,S000082813,FundX Conservative ETF,FundX Investment Trust,0001602508,,,2,103506280.96000001,0,,2026-04-15 08:10:18.206341,
4184,NPORT,series_id,S000081541,Tema Heart & Health ETF,Tema ETF Trust,0001944285,,,2,102564754.59000003,0,,2026-04-15 08:10:18.206341,
354,NPORT,series_id,1523289_0000910472-25-005393,Destra Multi-Alternative Fund,Destra Multi-Alternative Fund,0001523289,,,1,101609128.08999996,0,,2026-04-15 08:10:18.206341,
1087,NPORT,series_id,846671_0000846671-26-000005,Invesco High Income Trust II,Invesco High Income Trust II,0000846671,,,1,101367479.78999996,0,,2026-04-15 08:10:18.206341,
461,NPORT,series_id,1669380_0001193125-26-080883,NB Crossroads Private Markets Fund IV (TE) - Client LLC,NB Crossroads Private Markets Fund IV (TE) - Client LLC,0001669380,,,1,101172290.3636,0,,2026-04-15 08:10:18.206341,
485,NPORT,series_id,1702537_0001193125-26-080879,NB Crossroads Private Markets Fund V (TE) LP,NB Crossroads Private Markets Fund V (TE) LP,0001702537,,,1,100700482.05,0,,2026-04-15 08:10:18.206341,
341,NPORT,series_id,1514490_0001410368-26-011027,"ROYCE GLOBAL TRUST, INC.","ROYCE GLOBAL TRUST, INC.",0001514490,,,1,100103521.16000001,0,,2026-04-15 08:10:18.206341,
928,NPORT,series_id,2041175_0000894189-26-007173,NB Asset-Based Credit Fund,NB Asset-Based Credit Fund,0002041175,,,1,99973232.15000041,0,,2026-04-15 08:10:18.206341,
931,NPORT,series_id,2041175_0001193125-26-096699,NB Asset-Based Credit Fund,NB Asset-Based Credit Fund,0002041175,,,1,99973232.14999981,0,,2026-04-15 08:10:18.206341,
355,NPORT,series_id,1523289_0000910472-26-003455,Destra Multi-Alternative Fund,Destra Multi-Alternative Fund,0001523289,,,1,99793823.83000001,0,,2026-04-15 08:10:18.206341,
912,NPORT,series_id,2035632_0001193125-25-332684,John Hancock CQS Asset Backed Securities Fund,John Hancock CQS Asset Backed Securities Fund,0002035632,,,1,98028249.92999998,0,,2026-04-15 08:10:18.206341,
2261,NPORT,series_id,S000040553,Series F (Floating Rate Strategies Series),Guggenheim Variable Funds Trust,0000217087,,,2,97310047.94999999,0,,2026-04-15 08:10:18.206341,
3635,NPORT,series_id,S000075093,Rareview Systematic Equity ETF,Collaborative Investment Series Trust,0001719812,,,1,96832389.82,0,,2026-04-15 08:10:18.206341,
4391,NPORT,series_id,S000083459,Bancreek U.S. Large Cap ETF,Exchange Listed Funds Trust,0001547950,,,1,96587066.21000001,0,,2026-04-15 08:10:18.206341,
678,NPORT,series_id,1847305_0001410368-26-019258,"Tax-Free Fixed Income Fund IV for Puerto Rico Residents, Inc.","Tax-Free Fixed Income Fund IV for Puerto Rico Residents, Inc.",0001847305,,,1,96009767.74999997,0,,2026-04-15 08:10:18.206341,
1661,NPORT,series_id,S000009094,Federated Hermes Pennsylvania Municipal Income Fund,Federated Hermes Municipal Securities Income Trust,0000866700,,,1,95888279.51999994,0,,2026-04-15 08:10:18.206341,
409,NPORT,series_id,1589390_0000910472-26-003581,North Square Evanston Multi-Alpha Fund,North Square Evanston Multi-Alpha Fund,0001589390,,,1,94686710.47999997,0,,2026-04-15 08:10:18.206341,
3101,NPORT,series_id,S000067196,AltShares Merger Arbitrage ETF,AltShares Trust,0001779306,,,1,94035925.45999998,0,,2026-04-15 08:10:18.206341,
1085,NPORT,series_id,845611_0000940400-25-012132,Gabelli Convertible & Income Securities Fund Inc,Gabelli Convertible & Income Securities Fund Inc,0000845611,,,1,92819539.87999998,0,,2026-04-15 08:10:18.206341,
408,NPORT,series_id,1589390_0000910472-25-005261,North Square Evanston Multi-Alpha Fund,North Square Evanston Multi-Alpha Fund,0001589390,,,1,92804000.55999997,0,,2026-04-15 08:10:18.206341,
99,NPORT,series_id,1186641_0001193125-26-066285,A&Q Long/Short Strategies Fund LLC,A&Q Long/Short Strategies Fund LLC,0001186641,,,1,92497978.41999999,0,,2026-04-15 08:10:18.206341,
4603,NPORT,series_id,S000085236,Rareview Total Return Bond ETF,Collaborative Investment Series Trust,0001719812,,,2,92479784.95000003,0,,2026-04-15 08:10:18.206341,
987,NPORT,series_id,2076022_0001104659-26-021980,EP Private Capital Fund I,EP Private Capital Fund I,0002076022,,,1,92187283.58078897,0,,2026-04-15 08:10:18.206341,
746,NPORT,series_id,1897540_0000910472-26-002881,AOG Institutional Fund,AOG Institutional Fund,0001897540,,,1,92078530.65,0,,2026-04-15 08:10:18.206341,
4696,NPORT,series_id,S000085894,Long Pond Real Estate Select ETF,Exchange Listed Funds Trust,0001547950,,,1,92050385.91999999,0,,2026-04-15 08:10:18.206341,
905,NPORT,series_id,2031545_0001193125-25-287541,FT Vest Total Return Income Fund: Series A4,FT Vest Total Return Income Fund: Series A4,0002031545,,,1,91680564.97,0,,2026-04-15 08:10:18.206341,
4163,NPORT,series_id,S000081302,American Beacon AHL Trend ETF,AMERICAN BEACON SELECT FUNDS,0001096012,,,2,91193521.46999998,0,,2026-04-15 08:10:18.206341,
185,NPORT,series_id,1279394_0001193125-26-081185,"Cypress Creek Private Strategies Registered Fund, L.P.","Cypress Creek Private Strategies Registered Fund, L.P.",0001279394,,,1,91185060.55,0,,2026-04-15 08:10:18.206341,
1045,NPORT,series_id,813623_0000894189-25-015883,Total Return Securities Fund,Total Return Securities Fund,0000813623,,,1,91097163.50999999,0,,2026-04-15 08:10:18.206341,
196,NPORT,series_id,1286410_0001193125-25-300189,JP Morgan Access Multi-Strategy Fund LLC,JP Morgan Access Multi-Strategy Fund LLC,0001286410,,,1,91007546.0,0,,2026-04-15 08:10:18.206341,
906,NPORT,series_id,2031545_0001193125-26-081114,FT Vest Total Return Income Fund: Series A4,FT Vest Total Return Income Fund: Series A4,0002031545,,,1,90533629.82000004,0,,2026-04-15 08:10:18.206341,
938,NPORT,series_id,2041900_0001410368-26-033332,Columbia Credit Income Opportunities Fund,Columbia Credit Income Opportunities Fund,0002041900,,,1,90284449.75999999,0,,2026-04-15 08:10:18.206341,
1086,NPORT,series_id,845611_0000940400-26-009569,Gabelli Convertible & Income Securities Fund Inc,Gabelli Convertible & Income Securities Fund Inc,0000845611,,,1,89059906.23,0,,2026-04-15 08:10:18.206341,
98,NPORT,series_id,1186641_0001193125-25-295501,A&Q Long/Short Strategies Fund LLC,A&Q Long/Short Strategies Fund LLC,0001186641,,,1,87525832.70999998,0,,2026-04-15 08:10:18.206341,
5932,NPORT,series_id,0001716885_0001193125-26-136725,Angel Oak Strategic Credit Fund,Angel Oak Strategic Credit Fund,0001716885,,,1,87129962.05999999,0,,2026-04-15 10:07:22.720441,
507,NPORT,series_id,1716885_0001193125-25-335124,Angel Oak Strategic Credit Fund,Angel Oak Strategic Credit Fund,0001716885,,,1,86673071.96,0,,2026-04-15 08:10:18.206341,
201,NPORT,series_id,1288795_0001288795-25-000009,Clough Global Dividend and Income Fund,CLOUGH GLOBAL DIVIDEND AND INCOME FUND,0001288795,,,1,85917436.60999998,0,,2026-04-15 08:10:18.206341,
202,NPORT,series_id,1288795_0001288795-26-000009,Clough Global Dividend and Income Fund,CLOUGH GLOBAL DIVIDEND AND INCOME FUND,0001288795,,,1,85564846.70000003,0,,2026-04-15 08:10:18.206341,
262,NPORT,series_id,1385632_0000940400-26-002295,VOYA ASIA PACIFIC HIGH DIVIDEND EQUITY INCOME FUND,Voya Asia Pacific High Dividend Equity Income Fund,0001385632,,,1,84681509.37999997,0,,2026-04-15 08:10:18.206341,
4992,NPORT,series_id,S000088672,Indexperts Gorilla Aggressive Growth ETF,SPINNAKER ETF SERIES,0001484018,,,2,84670598.23999995,0,,2026-04-15 08:10:18.206341,
1017,NPORT,series_id,791718_0001003715-26-000515,"The European Equity Fund, Inc.","The European Equity Fund, Inc.",0000791718,,,1,84502607.04000004,0,,2026-04-15 08:10:18.206341,
1136,NPORT,series_id,885732_0000885732-26-000002,Nuveen California Select Tax-Free Income Portfolio,Nuveen California Select Tax-Free Income Portfolio,0000885732,,,1,84039208.01000002,0,,2026-04-15 08:10:18.206341,
2650,NPORT,series_id,S000057345,UVA Unconstrained Medium-Term Fixed Income ETF,SPINNAKER ETF SERIES,0001484018,,,2,83816477.84,0,,2026-04-15 08:10:18.206341,
732,NPORT,series_id,1881739_0001193125-25-328193,VARIANT IMPACT FUND,VARIANT IMPACT FUND,0001881739,,,1,83574859.8,0,,2026-04-15 08:10:18.206341,
648,NPORT,series_id,1830926_0001193125-26-074131,Emery Partners Income Credit Strategies Fund,Emery Partners Income Credit Strategies Fund,0001830926,,,1,83229269.93,0,,2026-04-15 08:10:18.206341,
885,NPORT,series_id,2022674_0001193125-25-328257,Variant Alternative Lending Fund,Variant Alternative Lending Fund,0002022674,,,1,82773749.86,0,,2026-04-15 08:10:18.206341,
2485,NPORT,series_id,S000050613,FlexShares Credit-Scored US Long Corporate Bond Index Fund,FlexShares Trust,0001491978,,,2,82525446.60999984,0,,2026-04-15 08:10:18.206341,
815,NPORT,series_id,1988752_0000910472-26-003724,MEKETA INFRASTRUCTURE FUND,MEKETA INFRASTRUCTURE FUND,0001988752,,,1,82424947.52999999,0,,2026-04-15 08:10:18.206341,
1113,NPORT,series_id,879535_0000940400-26-012474,DTF Tax-Free Income 2028 Term Fund INC,DTF TAX-FREE INCOME 2028 TERM FUND INC,0000879535,,,1,82323022.35999998,0,,2026-04-15 08:10:18.206341,
5063,NPORT,series_id,S000089262,Day Hagan Smart Buffer ETF,Strategy Shares,0001506213,,,2,81874786.0,0,,2026-04-15 08:10:18.206341,
733,NPORT,series_id,1881739_0001193125-26-129375,VARIANT IMPACT FUND,VARIANT IMPACT FUND,0001881739,,,1,81608612.94000001,0,,2026-04-15 08:10:18.206341,
1112,NPORT,series_id,879535_0000940400-25-013945,DTF Tax-Free Income 2028 Term Fund INC,DTF TAX-FREE INCOME 2028 TERM FUND INC,0000879535,,,1,81492714.34999998,0,,2026-04-15 08:10:18.206341,
856,NPORT,series_id,2008638_0001193125-25-332686,John Hancock CQS Multi Asset Credit Fund,John Hancock CQS Multi Asset Credit Fund,0002008638,,,1,81376014.10000002,0,,2026-04-15 08:10:18.206341,
937,NPORT,series_id,2041900_0001193125-25-329612,Columbia Credit Income Opportunities Fund,Columbia Credit Income Opportunities Fund,0002041900,,,1,81270517.24,0,,2026-04-15 08:10:18.206341,
1169,NPORT,series_id,908187_0001099263-25-004505,"PCM Fund, Inc.","PCM Fund, Inc.",0000908187,,,1,80141685.65000005,0,,2026-04-15 08:10:18.206341,
299,NPORT,series_id,1475457_0001193125-26-080203,"Grosvenor Registered Multi-Strategy Fund (TI 1), LLC","Grosvenor Registered Multi-Strategy Fund (TI 1), LLC",0001475457,,,1,79992964.23,0,,2026-04-15 08:10:18.206341,
5057,NPORT,series_id,S000089220,Thornburg Multi Sector Bond ETF,Thornburg ETF Trust,0002038383,,,1,79319231.5700001,0,,2026-04-15 08:10:18.206341,
1080,NPORT,series_id,838131_0000838131-26-000004,Nuveen Multi-Market Income Fund,Nuveen Multi-Market Income Fund,0000838131,,,1,78545759.83999996,0,,2026-04-15 08:10:18.206341,
1079,NPORT,series_id,838131_0000838131-25-000007,Nuveen Multi-Market Income Fund,Nuveen Multi-Market Income Fund,0000838131,,,1,78449231.08999996,0,,2026-04-15 08:10:18.206341,
978,NPORT,series_id,2066313_0000910472-26-003748,599 Fund LLC,599 Fund LLC,0002066313,,,1,78190973.02000001,0,,2026-04-15 08:10:18.206341,
1170,NPORT,series_id,908187_0001099263-26-003041,"PCM Fund, Inc.","PCM Fund, Inc.",0000908187,,,1,77820114.08999997,0,,2026-04-15 08:10:18.206341,
3511,NPORT,series_id,S000073362,FlexShares ESG & Climate Investment Grade Corporate Core Index Fund,FlexShares Trust,0001491978,,,2,77555072.91999996,0,,2026-04-15 08:10:18.206341,
814,NPORT,series_id,1988752_0000910472-25-004190,MEKETA INFRASTRUCTURE FUND,MEKETA INFRASTRUCTURE FUND,0001988752,,,1,77391022.01999998,0,,2026-04-15 08:10:18.206341,
902,NPORT,series_id,2029168_0001193125-26-074288,Callodine Specialty Income Fund,Callodine Specialty Income Fund,0002029168,,,1,77293449.99,0,,2026-04-15 08:10:18.206341,
619,NPORT,series_id,1807334_0002048251-25-002941,Wilshire Private Assets Fund,Wilshire Private Assets Fund,0001807334,,,1,76603095.43,0,,2026-04-15 08:10:18.206341,
2417,NPORT,series_id,S000047354,Virtus LifeSci Biotech Products ETF,ETFis Series Trust I,0001559109,,,2,76461535.24000001,0,,2026-04-15 08:10:18.206341,
606,NPORT,series_id,1807333_0002048251-25-002942,Wilshire Private Assets Master Fund,Wilshire Private Assets Master Fund,0001807333,,,1,76392314.44999999,0,,2026-04-15 08:10:18.206341,
930,NPORT,series_id,2041175_0001193125-26-096688,NB Asset-Based Credit Fund,NB Asset-Based Credit Fund,0002041175,,,1,76277144.79000081,0,,2026-04-15 08:10:18.206341,
927,NPORT,series_id,2041175_0000894189-25-016444,NB Asset-Based Credit Fund,NB Asset-Based Credit Fund,0002041175,,,1,76277144.79000019,0,,2026-04-15 08:10:18.206341,
929,NPORT,series_id,2041175_0000894189-26-007176,NB Asset-Based Credit Fund,NB Asset-Based Credit Fund,0002041175,,,1,76277144.78999977,0,,2026-04-15 08:10:18.206341,
886,NPORT,series_id,2022674_0001193125-26-129425,Variant Alternative Lending Fund,Variant Alternative Lending Fund,0002022674,,,1,75771658.85000001,0,,2026-04-15 08:10:18.206341,
3502,NPORT,series_id,S000072935,Atlas U.S. Tactical Income Fund,"Atlas U.S. Tactical Income Fund, Inc.",0001866278,,,1,75304977.94999997,0,,2026-04-15 08:10:18.206341,
1660,NPORT,series_id,S000009093,Federated Hermes Ohio Municipal Income Fund,Federated Hermes Municipal Securities Income Trust,0000866700,,,1,75091085.03000002,0,,2026-04-15 08:10:18.206341,
4515,NPORT,series_id,S000084449,Obra Opportunistic Structured Products ETF,SPINNAKER ETF SERIES,0001484018,,,2,74666591.03000003,0,,2026-04-15 08:10:18.206341,
857,NPORT,series_id,2008638_0002008638-26-000006,John Hancock CQS Multi Asset Credit Fund,John Hancock CQS Multi Asset Credit Fund,0002008638,,,1,74363369.75000001,0,,2026-04-15 08:10:18.206341,
965,NPORT,series_id,2055004_0001193125-26-066572,Pursuit Asset-Based Income Fund,Pursuit Asset-Based Income Fund,0002055004,,,1,73489904.42999999,0,,2026-04-15 08:10:18.206341,
4477,NPORT,series_id,S000084270,Bancreek International Large Cap ETF,Exchange Listed Funds Trust,0001547950,,,1,73258983.01,0,,2026-04-15 08:10:18.206341,
2346,NPORT,series_id,S000044182,WBI BullBear Yield 3000 ETF,Absolute Shares Trust,0001591939,,,2,72683752.10000004,0,,2026-04-15 08:10:18.206341,
3754,NPORT,series_id,S000076645,Day Hagan Smart Sector International ETF,Strategy Shares,0001506213,,,2,72456453.46000001,0,,2026-04-15 08:10:18.206341,
691,NPORT,series_id,1854370_0001193125-26-083097,Thirdline Real Estate Income Fund,Thirdline Real Estate Income Fund,0001854370,,,1,72191884.15,0,,2026-04-15 08:10:18.206341,
4993,NPORT,series_id,S000088673,Indexperts Quality Earnings Focused ETF,SPINNAKER ETF SERIES,0001484018,,,2,72032911.43000005,0,,2026-04-15 08:10:18.206341,
4779,NPORT,series_id,S000086524,Palmer Square CLO Senior Debt ETF,Palmer Square Funds Trust,0002014487,,,1,71736129.93999998,0,,2026-04-15 08:10:18.206341,
862,NPORT,series_id,2013732_0001193125-25-287462,FT Vest Hedged Equity Income Fund: Series A2,FT Vest Hedged Equity Income Fund: Series A2,0002013732,,,1,70823296.28,0,,2026-04-15 08:10:18.206341,
1103,NPORT,series_id,863900_0000894189-26-008463,Mexico Equity and Income Fund,Mexico Equity & Income Fund Inc,0000863900,,,1,70210308.24000001,0,,2026-04-15 08:10:18.206341,
796,NPORT,series_id,1959353_0000894189-26-003177,"Oxford Park Income Fund, Inc.","Oxford Park Income Fund, Inc.",0001959353,,,1,70165325.89,0,,2026-04-15 08:10:18.206341,
863,NPORT,series_id,2013732_0001193125-26-080966,FT Vest Hedged Equity Income Fund: Series A2,FT Vest Hedged Equity Income Fund: Series A2,0002013732,,,1,69889069.10999998,0,,2026-04-15 08:10:18.206341,
3905,NPORT,series_id,S000078302,Tema Durable Quality ETF,Tema ETF Trust,0001944285,,,1,69667778.70999998,0,,2026-04-15 08:10:18.206341,
3596,NPORT,series_id,S000074352,"U.S. Monthly Income Fund for Puerto Rico Residents, Inc.","U.S. Monthly Income Fund for Puerto Rico Residents, Inc.",0001843749,,,1,69546083.02000001,0,,2026-04-15 08:10:18.206341,
868,NPORT,series_id,2017577_0001193125-26-076946,Privacore PCAAM Alternative Growth Fund,Privacore PCAAM Alternative Growth Fund,0002017577,,,1,68496541.653137,0,,2026-04-15 08:10:18.206341,
298,NPORT,series_id,1475456_0001193125-26-080205,"Grosvenor Registered Multi-Strategy Fund (TI 2), LLC","Grosvenor Registered Multi-Strategy Fund (TI 2), LLC",0001475456,,,1,68389059.3,0,,2026-04-15 08:10:18.206341,
4683,NPORT,series_id,S000085755,Federated Hermes MDT Large Cap Value ETF,Federated Hermes ETF Trust,0001849998,,,1,67512424.90000004,0,,2026-04-15 08:10:18.206341,
538,NPORT,series_id,1742838_0001193125-26-080873,NB Crossroads Private Markets Fund VI Advisory LP,NB Crossroads Private Markets Fund VI Advisory LP,0001742838,,,1,67267314.63,0,,2026-04-15 08:10:18.206341,
4977,NPORT,series_id,S000088551,GMO U.S. Value ETF,GMO ETF Trust,0001981627,,,1,66975435.68999998,0,,2026-04-15 08:10:18.206341,
754,NPORT,series_id,1903070_0001410368-26-015788,Hartford Schroders Private Opportunities Fund,Hartford Schroders Private Opportunities Fund,0001903070,,,1,66872638.119999975,0,,2026-04-15 08:10:18.206341,
537,NPORT,series_id,1742838_0001193125-25-301955,NB Crossroads Private Markets Fund VI Advisory LP,NB Crossroads Private Markets Fund VI Advisory LP,0001742838,,,1,66871586.63,0,,2026-04-15 08:10:18.206341,
4084,NPORT,series_id,S000080680,TEXAS CAPITAL TEXAS EQUITY INDEX ETF,Texas Capital Funds Trust,0001972459,,,2,65999811.77,0,,2026-04-15 08:10:18.206341,
677,NPORT,series_id,1847304_0001410368-26-019261,"Tax-Free Fixed Income Fund III for Puerto Rico Residents, Inc.","Tax-Free Fixed Income Fund III for Puerto Rico Residents, Inc.",0001847304,,,1,65863837.47,0,,2026-04-15 08:10:18.206341,
675,NPORT,series_id,1847302_0001410368-26-019274,"Tax-Free Fixed Income Fund II for Puerto Rico Residents, Inc.","Tax-Free Fixed Income Fund II for Puerto Rico Residents, Inc.",0001847302,,,1,65795962.900000006,0,,2026-04-15 08:10:18.206341,
2347,NPORT,series_id,S000044183,WBI BullBear Quality 3000 ETF,Absolute Shares Trust,0001591939,,,2,65773152.19999999,0,,2026-04-15 08:10:18.206341,
5937,NPORT,series_id,0001869040_0000910472-26-005162,Lind Capital Partners Municipal Credit Income Fund,Lind Capital Partners Municipal Credit Income Fund,0001869040,,,1,65708307.69999997,0,,2026-04-15 10:07:22.720441,
3532,NPORT,series_id,S000073631,Day Hagan Smart Sector Fixed Income ETF,Strategy Shares,0001506213,,,2,65348142.81,0,,2026-04-15 08:10:18.206341,
719,NPORT,series_id,1869040_0000910472-25-005940,Lind Capital Partners Municipal Credit Income Fund,Lind Capital Partners Municipal Credit Income Fund,0001869040,,,1,65196803.7,0,,2026-04-15 08:10:18.206341,
231,NPORT,series_id,1320688_0001193125-26-081191,"Cypress Creek Private Strategies TEI Fund, L.P.","Cypress Creek Private Strategies TEI Fund, L.P.",0001320688,,,1,64527423.2,0,,2026-04-15 08:10:18.206341,
197,NPORT,series_id,1286410_0001193125-26-064362,JP Morgan Access Multi-Strategy Fund LLC,JP Morgan Access Multi-Strategy Fund LLC,0001286410,,,1,64511619.0,0,,2026-04-15 08:10:18.206341,
795,NPORT,series_id,1959353_0000894189-25-015531,"Oxford Park Income Fund, Inc.","Oxford Park Income Fund, Inc.",0001959353,,,1,64493766.27,0,,2026-04-15 08:10:18.206341,
4144,NPORT,series_id,S000081097,Madison Aggregate Bond ETF,Madison ETFs Trust,0001976877,,,1,63625637.25999998,0,,2026-04-15 08:10:18.206341,
4684,NPORT,series_id,S000085756,Federated Hermes MDT Small Cap Core ETF,Federated Hermes ETF Trust,0001849998,,,1,63491100.38,0,,2026-04-15 08:10:18.206341,
804,NPORT,series_id,1970466_0000926877-26-000084,First Trust Hedged Strategies Fund,First Trust Hedged Strategies Fund,0001970466,,,1,63407022.86999999,0,,2026-04-15 08:10:18.206341,
955,NPORT,series_id,2050541_0002071691-26-005291,First Eagle Tactical Municipal Opportunities Fund,First Eagle Tactical Municipal Opportunities Fund,0002050541,,,1,63327349.38999999,0,,2026-04-15 08:10:18.206341,
566,NPORT,series_id,1771226_0001049169-25-000838,RiverNorth Managed Duration Muni Income Fund Inc.,RiverNorth Managed Duration Municipal Income Fund Inc.,0001771226,,,1,63093407.0499999,0,,2026-04-15 08:10:18.206341,
2613,NPORT,series_id,S000055583,WBI Power Factor High Dividend ETF,Absolute Shares Trust,0001591939,,,1,62635442.79,0,,2026-04-15 08:10:18.206341,
4436,NPORT,series_id,S000083941,MassMutual Clinton Municipal Fund,MassMutual Advantage Funds,0001859808,,,1,62531083.769999996,0,,2026-04-15 08:10:18.206341,
1102,NPORT,series_id,863900_0000894189-25-018623,Mexico Equity and Income Fund,Mexico Equity & Income Fund Inc,0000863900,,,1,62524071.030000016,0,,2026-04-15 08:10:18.206341,
881,NPORT,series_id,2021979_0000926877-26-000104,First Trust Enhanced Private Credit Fund,First Trust Enhanced Private Credit Fund,0002021979,,,1,62355904.08,0,,2026-04-15 08:10:18.206341,
957,NPORT,series_id,2051512_0000894189-25-016105,Oaktree Asset-Backed Income Private Placement Fund Inc.,Oaktree Asset-Backed Income Private Placement Fund Inc.,0002051512,,,1,61934597.849999994,0,,2026-04-15 08:10:18.206341,
4142,NPORT,series_id,S000081095,Madison Short-Term Strategic Income ETF,Madison ETFs Trust,0001976877,,,1,61925647.97999998,0,,2026-04-15 08:10:18.206341,
805,NPORT,series_id,1970466_0001193125-25-303789,First Trust Hedged Strategies Fund,First Trust Hedged Strategies Fund,0001970466,,,1,61701637.870000005,0,,2026-04-15 08:10:18.206341,
446,NPORT,series_id,1644771_0001049169-26-000381,RiverNorth Capital and Income Fund,RiverNorth Capital and Income Fund,0001644771,,,1,61609122.3100001,0,,2026-04-15 08:10:18.206341,
4143,NPORT,series_id,S000081096,Madison Dividend Value ETF,Madison ETFs Trust,0001976877,,,1,61223856.379999995,0,,2026-04-15 08:10:18.206341,
2416,NPORT,series_id,S000047353,Virtus LifeSci Biotech Clinical Trials ETF,ETFis Series Trust I,0001559109,,,2,61133577.31000004,0,,2026-04-15 08:10:18.206341,
3258,NPORT,series_id,S000069798,Rareview Dynamic Fixed Income ETF,Collaborative Investment Series Trust,0001719812,,,1,60913200.469999984,0,,2026-04-15 08:10:18.206341,
764,NPORT,series_id,1912938_0000926877-26-000102,First Trust Private Assets Fund,First Trust Private Assets Fund,0001912938,,,1,60570847.03,0,,2026-04-15 08:10:18.206341,
2372,NPORT,series_id,S000045498,Guggenheim Variable Insurance Strategy Fund III,Guggenheim Strategy Funds Trust,0001601445,,,2,60362827.720000036,0,,2026-04-15 08:10:18.206341,
5169,NPORT,series_id,S000090015,Nomura National High-Yield Municipal Bond ETF,Nomura ETF Trust,0001969995,,,2,60205968.46000001,0,,2026-04-15 08:10:18.206341,
3014,NPORT,series_id,S000065358,QRAFT AI-Enhanced U.S. Large Cap Momentum ETF,Exchange Listed Funds Trust,0001547950,,,2,59526540.839999996,0,,2026-04-15 08:10:18.206341,
518,NPORT,series_id,1725295_0001193125-25-301295,"Tax-Exempt Private Credit Fund, Inc.","Tax-Exempt Private Credit Fund, Inc.",0001725295,,,1,59504678.05,0,,2026-04-15 08:10:18.206341,
4516,NPORT,series_id,S000084450,Obra High Grade Structured Products ETF,SPINNAKER ETF SERIES,0001484018,,,2,59502264.44000003,0,,2026-04-15 08:10:18.206341,
2345,NPORT,series_id,S000044181,WBI BullBear Value 3000 ETF,Absolute Shares Trust,0001591939,,,2,58059677.450000025,0,,2026-04-15 08:10:18.206341,
963,NPORT,series_id,2054995_0001410368-25-030853,Lincoln Partners Group Royalty Fund,Lincoln Partners Group Royalty Fund,0002054995,,,1,57617569.870000005,0,,2026-04-15 08:10:18.206341,
5121,NPORT,series_id,S000089482,PLUS Korea Defense Industry Index ETF,Exchange Listed Funds Trust,0001547950,,,1,57370744.70000001,0,,2026-04-15 08:10:18.206341,
1694,NPORT,series_id,S000010055,Series P (High Yield Series),Guggenheim Variable Funds Trust,0000217087,,,2,56729462.820000045,0,,2026-04-15 08:10:18.206341,
1107,NPORT,series_id,876717_0001410368-25-042507,"ABRDN GLOBAL INCOME FUND, INC.","ABRDN GLOBAL INCOME FUND, INC.",0000876717,,,1,56718889.02999996,0,,2026-04-15 08:10:18.206341,
4534,NPORT,series_id,S000084713,Anydrus Advantage ETF,Collaborative Investment Series Trust,0001719812,,,1,56253492.63000002,0,,2026-04-15 08:10:18.206341,
3089,NPORT,series_id,S000066847,Strategy Shares Newfound/Resolve Robust Momentum ETF,Strategy Shares,0001506213,,,2,55658320.92000001,0,,2026-04-15 08:10:18.206341,
943,NPORT,series_id,2044327_0001049169-25-000602,C1 Fund Inc.,C1 Fund Inc.,0002044327,,,1,55594852.87,0,,2026-04-15 08:10:18.206341,
1108,NPORT,series_id,876717_0001410368-26-029998,"ABRDN GLOBAL INCOME FUND, INC.","ABRDN GLOBAL INCOME FUND, INC.",0000876717,,,1,55590396.700000025,0,,2026-04-15 08:10:18.206341,
882,NPORT,series_id,2021979_0001193125-25-303818,First Trust Enhanced Private Credit Fund,First Trust Enhanced Private Credit Fund,0002021979,,,1,55177641.50000001,0,,2026-04-15 08:10:18.206341,
944,NPORT,series_id,2044327_0001049169-26-000753,C1 Fund Inc.,C1 Fund Inc.,0002044327,,,1,54706704.73,0,,2026-04-15 08:10:18.206341,
784,NPORT,series_id,1949594_0000035402-26-001243,Fidelity Multi-Strategy Credit Fund,Fidelity Multi-Strategy Credit Fund,0001949594,,,1,54268624.89999998,0,,2026-04-15 08:10:18.206341,
2163,NPORT,series_id,S000035751,Arrow Dow Jones Global Yield ETF,Arrow ETF Trust,0001532206,,,2,54136782.02999996,0,,2026-04-15 08:10:18.206341,
783,NPORT,series_id,1949594_0000035402-25-002199,Fidelity Multi-Strategy Credit Fund,Fidelity Multi-Strategy Credit Fund,0001949594,,,1,54090057.48000002,0,,2026-04-15 08:10:18.206341,
801,NPORT,series_id,1968178_0002048251-26-000648,SEI Alternative Income Fund,SEI Alternative Income Fund,0001968178,,,1,54017803.330000006,0,,2026-04-15 08:10:18.206341,
