resolution_id,source_type,identifier_type,series_id,series_name,family_name,filer_cik,filer_name,inst_parent_name,report_month_count,total_nav,candidate_entity_count,candidate_names,pending_since,decision
1016,NPORT,series_id,790500_0001410368-26-029991,"ABRDN ASIA-PACIFIC INCOME FUND, INC.","ABRDN ASIA-PACIFIC INCOME FUND, INC.",0000790500,,,1,1091868647.9500005,0,,2026-04-15 08:10:18.206341,
1662,NPORT,series_id,S000009106,Federated Hermes Corporate Bond Fund,"Federated Hermes Investment Series Funds, Inc.",0000889388,,,1,1090047727.25,0,,2026-04-15 08:10:18.206341,
169,NPORT,series_id,1268884_0000940400-25-009998,CBRE Global Real Estate Income Fund,CBRE Global Real Estate Income Fund,0001268884,,,1,1089996579.7600005,0,,2026-04-15 08:10:18.206341,
1015,NPORT,series_id,790500_0001410368-25-042522,"ABRDN ASIA-PACIFIC INCOME FUND, INC.","ABRDN ASIA-PACIFIC INCOME FUND, INC.",0000790500,,,1,1089563606.6299999,0,,2026-04-15 08:10:18.206341,
533,NPORT,series_id,1742836_0001193125-25-330321,"Macquarie Focused Access Fund, LLC","Macquarie Focused Access Fund, LLC",0001742836,,,1,1088728002.57,0,,2026-04-15 08:10:18.206341,
256,NPORT,series_id,1379400_0001410368-26-029990,abrdn Total Dynamic Dividend Fund,abrdn Total Dynamic Dividend Fund,0001379400,,,1,1082957577.86,0,,2026-04-15 08:10:18.206341,
232,NPORT,series_id,1322435_0001410368-25-032323,Eaton Vance Tax-Managed Global Buy-Write Opportunities Fund,Eaton Vance Tax-Managed Global Buy-Write Opportunities Fund,0001322435,,,1,1080490782.4599998,0,,2026-04-15 08:10:18.206341,
558,NPORT,series_id,1756908_0001099263-26-003118,PIMCO Dynamic Income Strategy Fund,PIMCO Dynamic Income Strategy Fund,0001756908,,,1,1079207692.49,0,,2026-04-15 08:10:18.206341,
1094,NPORT,series_id,855886_0000855886-26-000006,John Hancock Premium Dividend Fund,John Hancock Premium Dividend Fund,0000855886,,,1,1076740838.3199997,0,,2026-04-15 08:10:18.206341,
581,NPORT,series_id,1785971_0001410368-26-016989,BlackRock Health Sciences Term Trust,BlackRock Health Sciences Term Trust,0001785971,,,1,1075875518.08,0,,2026-04-15 08:10:18.206341,
1129,NPORT,series_id,884152_0000884152-26-000004,Invesco Municipal Opportunity Trust,Invesco Municipal Opportunity Trust,0000884152,,,1,1075362195.049999,0,,2026-04-15 08:10:18.206341,
694,NPORT,series_id,1855066_0002071691-26-000974,NYLI CBRE Global Infrastructure Megatrends Term Fund,NYLI CBRE Global Infrastructure Megatrends Term Fund,0001855066,,,1,1072507468.1200001,0,,2026-04-15 08:10:18.206341,
255,NPORT,series_id,1379400_0001410368-25-042506,abrdn Total Dynamic Dividend Fund,abrdn Total Dynamic Dividend Fund,0001379400,,,1,1062278253.4899999,0,,2026-04-15 08:10:18.206341,
3899,NPORT,series_id,S000078169,Federated Hermes U.S. Strategic Dividend ETF,Federated Hermes ETF Trust,0001849998,,,2,1058268025.4000001,0,,2026-04-15 08:10:18.206341,
1095,NPORT,series_id,855886_0001193125-25-332695,John Hancock Premium Dividend Fund,John Hancock Premium Dividend Fund,0000855886,,,1,1057699740.39,0,,2026-04-15 08:10:18.206341,
383,NPORT,series_id,1560916_0001049169-25-000963,CPG Carlyle Commitments Fund LLC,CPG CARLYLE COMMITMENTS FUND LLC,0001560916,,,1,1054697936.53,0,,2026-04-15 08:10:18.206341,
331,NPORT,series_id,1503290_0001410368-26-029997,abrdn Income Credit Strategies Fund,abrdn Income Credit Strategies Fund,0001503290,,,1,1051798343.9700004,1,"abrdn Income Credit Strategies Fund  (ACP, ACP-PA)",2026-04-15 08:10:18.206341,
998,NPORT,series_id,33934_0000910472-26-002559,"Cornerstone Total Return Fund, Inc.","Cornerstone Total Return Fund, Inc.",0000033934,,,1,1049907135.1199998,0,,2026-04-15 08:10:18.206341,
108,NPORT,series_id,1195738_0001195738-26-000002,Nuveen California AMT-Free Quality Municipal Income Fund,Nuveen California AMT-Free Quality Municipal Income Fund,0001195738,,,1,1049711246.7700002,0,,2026-04-15 08:10:18.206341,
1665,NPORT,series_id,S000009129,High Yield Bond Core Fund,Federated Hermes Core Trust,0001034106,,,1,1046920104.3099991,0,,2026-04-15 08:10:18.206341,
309,NPORT,series_id,1493683_0001410368-26-016991,BlackRock Taxable Municipal Bond Trust,BlackRock Taxable Municipal Bond Trust,0001493683,,,1,1045134482.0199999,0,,2026-04-15 08:10:18.206341,
330,NPORT,series_id,1503290_0001410368-25-042520,abrdn Income Credit Strategies Fund,abrdn Income Credit Strategies Fund,0001503290,,,1,1026668736.1200004,1,"abrdn Income Credit Strategies Fund  (ACP, ACP-PA)",2026-04-15 08:10:18.206341,
416,NPORT,series_id,1604522_0001410368-26-020669,abrdn Healthcare Opportunities Fund,abrdn Healthcare Opportunities Fund,0001604522,,,1,1025146266.4899998,0,,2026-04-15 08:10:18.206341,
1893,NPORT,series_id,S000020099,Miller Convertible Bond Fund,Miller Investment Trust,0001414039,,,2,1022154086.3600001,0,,2026-04-15 08:10:18.206341,
968,NPORT,series_id,2059436_0001410368-25-032711,Blue Owl Alternative Credit Fund,Blue Owl Alternative Credit Fund,0002059436,,,1,1017649376.0216022,0,,2026-04-15 08:10:18.206341,
622,NPORT,series_id,1810256_0001193125-26-069319,Bow River Capital Evergreen Fund,Bow River Capital Evergreen Fund,0001810256,,,1,1010924337.2119999,0,,2026-04-15 08:10:18.206341,
2602,NPORT,series_id,S000055344,Davis Select Worldwide ETF,Davis Fundamental ETF Trust,0001670310,,,2,1009073112.75,0,,2026-04-15 08:10:18.206341,
107,NPORT,series_id,1195738_0001195738-25-000005,Nuveen California AMT-Free Quality Municipal Income Fund,Nuveen California AMT-Free Quality Municipal Income Fund,0001195738,,,1,1006294740.3900006,0,,2026-04-15 08:10:18.206341,
182,NPORT,series_id,1278895_0001410368-26-016964,"BlackRock Enhanced Large Cap Core Fund, Inc","BlackRock Enhanced Large Cap Core Fund, Inc",0001278895,,,1,1005516143.8300002,0,,2026-04-15 08:10:18.206341,
568,NPORT,series_id,1774342_0001774342-25-000009,Nuveen Municipal Credit Opportunities Fund,Nuveen Municipal Credit Opportunities Fund,0001774342,,,1,1003518607.360001,0,,2026-04-15 08:10:18.206341,
830,NPORT,series_id,1995940_0000940400-26-009024,AMG Pantheon Credit Solutions Fund,AMG PANTHEON CREDIT SOLUTIONS FUND,0001995940,,,1,1002564234.0299997,0,,2026-04-15 08:10:18.206341,
170,NPORT,series_id,1268884_0000940400-26-007378,CBRE Global Real Estate Income Fund,CBRE Global Real Estate Income Fund,0001268884,,,1,1002522862.02,0,,2026-04-15 08:10:18.206341,
569,NPORT,series_id,1774342_0001774342-26-000006,Nuveen Municipal Credit Opportunities Fund,Nuveen Municipal Credit Opportunities Fund,0001774342,,,1,1001337157.2400006,0,,2026-04-15 08:10:18.206341,
384,NPORT,series_id,1560916_0001049169-25-000965,CPG Carlyle Commitments Fund LLC,CPG CARLYLE COMMITMENTS FUND LLC,0001560916,,,1,1001298561.09,0,,2026-04-15 08:10:18.206341,
570,NPORT,series_id,1777482_0001777482-26-000004,Nuveen Enhanced High Yield Municipal Bond Fund,Nuveen Enhanced High Yield Municipal Bond Fund,0001777482,,,1,997965310.6500005,0,,2026-04-15 08:10:18.206341,
575,NPORT,series_id,1778114_0000940400-25-014232,Virtus Artificial Intelligence & Technology Opportunities Fund,Virtus Artificial Intelligence & Technology Opportunities Fund,0001778114,,,1,994705123.02,0,,2026-04-15 08:10:18.206341,
449,NPORT,series_id,1655099_0000894189-25-016167,Brookfield Real Assets Income Fund Inc.,Brookfield Real Assets Income Fund Inc.,0001655099,,,1,992420583.749999,0,,2026-04-15 08:10:18.206341,
2493,NPORT,series_id,S000051603,Aspiriant Defensive Allocation Fund,Aspiriant Trust,0001534881,,,1,989520766.8199998,0,,2026-04-15 08:10:18.206341,
1168,NPORT,series_id,906013_0001410368-26-018318,AllianceBernstein Global High Income Fund Inc,AllianceBernstein Global High Income Fund Inc,0000906013,,,1,984440511.059999,0,,2026-04-15 08:10:18.206341,
576,NPORT,series_id,1778114_0000940400-26-012433,Virtus Artificial Intelligence & Technology Opportunities Fund,Virtus Artificial Intelligence & Technology Opportunities Fund,0001778114,,,1,983766528.7699999,0,,2026-04-15 08:10:18.206341,
450,NPORT,series_id,1655099_0000894189-26-006679,Brookfield Real Assets Income Fund Inc.,Brookfield Real Assets Income Fund Inc.,0001655099,,,1,983732760.6299995,0,,2026-04-15 08:10:18.206341,
122,NPORT,series_id,1219360_0001099263-25-004535,PIMCO High Income Fund,PIMCO High Income Fund,0001219360,,,1,983730636.6000007,0,,2026-04-15 08:10:18.206341,
844,NPORT,series_id,2004413_0000910472-26-003600,Beacon Pointe Multi-Alternative Fund,Beacon Pointe Multi-Alternative Fund,0002004413,,,1,982032131.4300001,0,,2026-04-15 08:10:18.206341,
377,NPORT,series_id,1557265_0001193125-25-289155,The Private Shares Fund,The Private Shares Fund,0001557265,,,1,981814873.7700001,0,,2026-04-15 08:10:18.206341,
181,NPORT,series_id,1278895_0001410368-25-032178,"BlackRock Enhanced Large Cap Core Fund, Inc","BlackRock Enhanced Large Cap Core Fund, Inc",0001278895,,,1,981334514.4699999,0,,2026-04-15 08:10:18.206341,
123,NPORT,series_id,1219360_0001099263-26-003071,PIMCO High Income Fund,PIMCO High Income Fund,0001219360,,,1,980481129.7199999,0,,2026-04-15 08:10:18.206341,
2369,NPORT,series_id,S000045418,InfraCap MLP ETF,ETFis Series Trust I,0001559109,,,2,972064628.0400001,0,,2026-04-15 08:10:18.206341,
467,NPORT,series_id,1677615_0001193125-26-065552,Federated Hermes Project & Trade Finance Tender Fund,Federated Hermes Project & Trade Finance Tender Fund,0001677615,,,1,971673400.1500003,0,,2026-04-15 08:10:18.206341,
370,NPORT,series_id,1548717_0001410368-25-032590,"Cohen & Steers Ltd Duration Preferred & Income Fund, Inc.","Cohen & Steers Ltd Duration Preferred & Income Fund, Inc.",0001548717,,,1,967265367.7199999,0,,2026-04-15 08:10:18.206341,
415,NPORT,series_id,1604522_0001410368-25-032519,abrdn Healthcare Opportunities Fund,abrdn Healthcare Opportunities Fund,0001604522,,,1,966717383.3799998,0,,2026-04-15 08:10:18.206341,
371,NPORT,series_id,1548717_0001410368-26-019350,"Cohen & Steers Ltd Duration Preferred & Income Fund, Inc.","Cohen & Steers Ltd Duration Preferred & Income Fund, Inc.",0001548717,,,1,960089632.9399999,0,,2026-04-15 08:10:18.206341,
58,NPORT,series_id,1140411_0001099263-25-004530,PIMCO California Municipal Income Fund,PIMCO California Municipal Income Fund,0001140411,,,1,956131407.0200003,1,PIMCO CALIFORNIA MUNICIPAL INCOME FUND,2026-04-15 08:10:18.206341,
2047,NPORT,series_id,S000029838,AB Taxable Multi-Sector Income Shares,AB CORPORATE SHARES,0001274676,,,2,955421778.9299995,0,,2026-04-15 08:10:18.206341,
638,NPORT,series_id,1818416_0002071691-25-007734,First Eagle Credit Opportunities Fund,First Eagle Credit Opportunities Fund,0001818416,,,1,948723399.0152471,0,,2026-04-15 08:10:18.206341,
59,NPORT,series_id,1140411_0001099263-26-003066,PIMCO California Municipal Income Fund,PIMCO California Municipal Income Fund,0001140411,,,1,947915174.2199998,1,PIMCO CALIFORNIA MUNICIPAL INCOME FUND,2026-04-15 08:10:18.206341,
921,NPORT,series_id,2039471_0000910472-26-002737,Ardian Access LLC,Ardian Access LLC,0002039471,,,1,944565226.4399999,0,,2026-04-15 08:10:18.206341,
1719,NPORT,series_id,S000011063,Bernstein Intermediate Duration Institutional Portfolio,BERNSTEIN SANFORD C FUND II INC,0001166729,,,1,943728853.89,0,,2026-04-15 08:10:18.206341,
222,NPORT,series_id,1313510_0000940400-26-009522,"GAMCO Global Gold, Natural Resources & Income Trust","GAMCO Global Gold, Natural Resources & Income Trust",0001313510,,,1,931995588.2800003,0,,2026-04-15 08:10:18.206341,
88,NPORT,series_id,1176194_0001410368-26-031700,BlackRock Municipal Income Trust II,BlackRock Municipal Income Trust II,0001176194,,,1,926546845.5099992,0,,2026-04-15 08:10:18.206341,
658,NPORT,series_id,1836057_0001410368-26-017000,BlackRock Technology and Private Equity Term Trust,BlackRock Technology and Private Equity Term Trust,0001836057,,,1,920051635.7299997,0,,2026-04-15 08:10:18.206341,
87,NPORT,series_id,1176194_0001410368-25-043493,BlackRock Municipal Income Trust II,BlackRock Municipal Income Trust II,0001176194,,,1,913078109.5499992,0,,2026-04-15 08:10:18.206341,
369,NPORT,series_id,1546429_0001049169-26-000322,Blackstone Strategic Credit 2027 Term Fund,Blackstone Strategic Credit 2027 Term Fund,0001546429,,,1,910388438.7299998,0,,2026-04-15 08:10:18.206341,
1109,NPORT,series_id,877463_0000877463-26-000004,Invesco Municipal Trust,Invesco Municipal Trust,0000877463,,,1,908615572.74,0,,2026-04-15 08:10:18.206341,
387,NPORT,series_id,1560917_0001049169-25-000966,CPG Carlyle Commitments Master Fund LLC,CPG CARLYLE COMMITMENTS MASTER FUND LLC,0001560917,,,1,904113422.3400002,0,,2026-04-15 08:10:18.206341,
368,NPORT,series_id,1546429_0001049169-25-000898,Blackstone Strategic Credit 2027 Term Fund,Blackstone Strategic Credit 2027 Term Fund,0001546429,,,1,903860816.0900004,0,,2026-04-15 08:10:18.206341,
65,NPORT,series_id,1160990_0001099263-25-004531,PIMCO Corporate & Income Strategy Fund,PIMCO Corporate & Income Strategy Fund,0001160990,,,1,903082310.1600002,0,,2026-04-15 08:10:18.206341,
66,NPORT,series_id,1160990_0001099263-26-003067,PIMCO Corporate & Income Strategy Fund,PIMCO Corporate & Income Strategy Fund,0001160990,,,1,902719909.8700004,0,,2026-04-15 08:10:18.206341,
45,NPORT,series_id,1087786_0001087786-26-000002,Nuveen New Jersey Quality Municipal Income Fund,Nuveen New Jersey Quality Municipal Income Fund,0001087786,,,1,901141007.2699994,0,,2026-04-15 08:10:18.206341,
1110,NPORT,series_id,879361_0001410368-25-043492,"BlackRock MuniYield Fund, Inc.","BlackRock MuniYield Fund, Inc.",0000879361,,,1,901004379.3300002,0,,2026-04-15 08:10:18.206341,
592,NPORT,series_id,1793129_0001793129-26-000006,Nuveen Dynamic Municipal Opportunities Fund,Nuveen Dynamic Municipal Opportunities Fund,0001793129,,,1,900004562.2500001,0,,2026-04-15 08:10:18.206341,
584,NPORT,series_id,1788399_0001193125-26-075572,DoubleLine Yield Opportunities Fund,DoubleLine Yield Opportunities Fund,0001788399,,,1,898308976.6199999,0,,2026-04-15 08:10:18.206341,
1134,NPORT,series_id,885601_0000885601-26-000004,Invesco Value Municipal Income Trust,Invesco Value Municipal Income Trust,0000885601,,,1,897714482.8499992,0,,2026-04-15 08:10:18.206341,
1111,NPORT,series_id,879361_0001410368-26-031741,"BlackRock MuniYield Fund, Inc.","BlackRock MuniYield Fund, Inc.",0000879361,,,1,897014318.1399997,0,,2026-04-15 08:10:18.206341,
1137,NPORT,series_id,886043_0000940400-26-001992,Western Asset Managed Municipals Fund Inc.,Western Asset Managed Municipals Fund Inc.,0000886043,,,1,894456551.6249999,0,,2026-04-15 08:10:18.206341,
1117,NPORT,series_id,880892_0000880892-26-000004,Invesco Trust for Investment Grade Municipals,Invesco Trust for Investment Grade Municipals,0000880892,,,1,889860177.8100002,0,,2026-04-15 08:10:18.206341,
591,NPORT,series_id,1793129_0001793129-25-000009,Nuveen Dynamic Municipal Opportunities Fund,Nuveen Dynamic Municipal Opportunities Fund,0001793129,,,1,886374988.4199997,0,,2026-04-15 08:10:18.206341,
666,NPORT,series_id,1844684_0000894189-26-007076,NC SLF INC.,NC SLF INC.,0001844684,,,1,882854662.6700001,0,,2026-04-15 08:10:18.206341,
412,NPORT,series_id,1602584_0001410368-26-034369,Calamos Dynamic Convertible & Income Fund,Calamos Dynamic Convertible & Income Fund,0001602584,,,1,882811986.0900005,0,,2026-04-15 08:10:18.206341,
336,NPORT,series_id,1506289_0001410368-26-017007,BlackRock Resources & Commodities Strategy Trust,BlackRock Resources & Commodities Strategy Trust,0001506289,,,1,882511375.49,0,,2026-04-15 08:10:18.206341,
1133,NPORT,series_id,885601_0000885601-25-000009,Invesco Value Municipal Income Trust,Invesco Value Municipal Income Trust,0000885601,,,1,872044513.7300006,0,,2026-04-15 08:10:18.206341,
770,NPORT,series_id,1918767_0001193125-26-075555,"Constitution Capital Access Fund, LLC","Constitution Capital Access Fund, LLC",0001918767,,,1,871681853.7099999,0,,2026-04-15 08:10:18.206341,
221,NPORT,series_id,1313510_0000940400-25-012096,"GAMCO Global Gold, Natural Resources & Income Trust","GAMCO Global Gold, Natural Resources & Income Trust",0001313510,,,1,871102298.4399996,0,,2026-04-15 08:10:18.206341,
411,NPORT,series_id,1602584_0001410368-25-042367,Calamos Dynamic Convertible & Income Fund,Calamos Dynamic Convertible & Income Fund,0001602584,,,1,870191347.2900007,0,,2026-04-15 08:10:18.206341,
2980,NPORT,series_id,S000064832,Preferred Securities and Income SMA Shares,"Cohen & Steers Preferred Securities & Income SMA Shares, Inc.",0001760077,,,2,869788587.1599997,0,,2026-04-15 08:10:18.206341,
792,NPORT,series_id,1957892_0001193125-26-081487,StepStone Private Infrastructure Fund,StepStone Private Infrastructure Fund,0001957892,,,1,867693536.2399998,0,,2026-04-15 08:10:18.206341,
213,NPORT,series_id,1300391_0001410368-26-020587,Eaton Vance Enhanced Equity Income Fund,Eaton Vance Enhanced Equity Income Fund,0001300391,,,1,865468682.9800003,0,,2026-04-15 08:10:18.206341,
3776,NPORT,series_id,S000077078,Short Duration Inflation-Protected Income Portfolio,Short Duration Inflation-Protected Income Portfolio,0001928846,,,2,856666537.8899999,0,,2026-04-15 08:10:18.206341,
27,NPORT,series_id,1059386_0001059386-25-000005,Invesco Senior Income Trust,Invesco Senior Income Trust,0001059386,,,1,855896177.1100001,0,,2026-04-15 08:10:18.206341,
1116,NPORT,series_id,880892_0000880892-25-000009,Invesco Trust for Investment Grade Municipals,Invesco Trust for Investment Grade Municipals,0000880892,,,1,852401136.0699999,0,,2026-04-15 08:10:18.206341,
137,NPORT,series_id,1227862_0000940400-26-007234,Western Asset Emerging Markets Debt Fund Inc.,Western Asset Emerging Markets Debt Fund Inc.,0001227862,,,1,852284753.5099993,0,,2026-04-15 08:10:18.206341,
1188,NPORT,series_id,925683_0001193125-26-080778,John Hancock Financial Opportunities Fund,John Hancock Financial Opportunities Fund,0000925683,,,1,847538900.3,0,,2026-04-15 08:10:18.206341,
28,NPORT,series_id,1059386_0001059386-26-000004,Invesco Senior Income Trust,Invesco Senior Income Trust,0001059386,,,1,841728885.1100007,0,,2026-04-15 08:10:18.206341,
2384,NPORT,series_id,S000045949,EUBEL BRADY & SUTTMAN INCOME FUND,Eubel Brady & Suttman Mutual Fund Trust,0001606378,,,2,840632033.3900001,0,,2026-04-15 08:10:18.206341,
501,NPORT,series_id,1710680_0002048251-25-002966,Highland Opportunities and Income Fund,Highland Opportunities and Income Fund,0001710680,,,1,836996968.0600003,0,,2026-04-15 08:10:18.206341,
1153,NPORT,series_id,895531_0000895531-26-000004,Invesco California Value Municipal Income Trust,Invesco California Value Municipal Income Trust,0000895531,,,1,832963873.4999993,0,,2026-04-15 08:10:18.206341,
502,NPORT,series_id,1710680_0002048251-26-001891,Highland Opportunities and Income Fund,Highland Opportunities and Income Fund,0001710680,,,1,832285630.6099998,0,,2026-04-15 08:10:18.206341,
1187,NPORT,series_id,925683_0001193125-25-299780,John Hancock Financial Opportunities Fund,John Hancock Financial Opportunities Fund,0000925683,,,1,828656338.3000002,0,,2026-04-15 08:10:18.206341,
1132,NPORT,series_id,885125_0000885125-26-000004,Invesco Quality Municipal Income Trust,Invesco Quality Municipal Income Trust,0000885125,,,1,817468728.3399999,0,,2026-04-15 08:10:18.206341,
55,NPORT,series_id,1137393_0001410368-26-031690,BlackRock Municipal Income Trust,BlackRock Municipal Income Trust,0001137393,,,1,815152298.6499995,0,,2026-04-15 08:10:18.206341,
54,NPORT,series_id,1137393_0001410368-25-043468,BlackRock Municipal Income Trust,BlackRock Municipal Income Trust,0001137393,,,1,813209545.99,0,,2026-04-15 08:10:18.206341,
2158,NPORT,series_id,S000035083,AZL MVP Global Balanced Index Strategy Fund,Allianz Variable Insurance Products Fund of Funds Trust,0001301708,,,2,802653371.0,0,,2026-04-15 08:10:18.206341,
639,NPORT,series_id,1818416_0002071691-26-005293,First Eagle Credit Opportunities Fund,First Eagle Credit Opportunities Fund,0001818416,,,1,797999771.2667209,0,,2026-04-15 08:10:18.206341,
209,NPORT,series_id,1296250_0001099263-25-004537,PIMCO Income Strategy Fund II,PIMCO Income Strategy Fund II,0001296250,,,1,790895062.5200002,0,,2026-04-15 08:10:18.206341,
210,NPORT,series_id,1296250_0001099263-26-003073,PIMCO Income Strategy Fund II,PIMCO Income Strategy Fund II,0001296250,,,1,789565824.4900002,0,,2026-04-15 08:10:18.206341,
391,NPORT,series_id,1562818_0001410368-26-016976,BlackRock Multi-Sector Income Trust,BlackRock Multi-Sector Income Trust,0001562818,,,1,783769959.7899991,0,,2026-04-15 08:10:18.206341,
278,NPORT,series_id,1396277_0001410368-26-034350,Calamos Global Dynamic Income Fund,Calamos Global Dynamic Income Fund,0001396277,,,1,783552570.8699988,0,,2026-04-15 08:10:18.206341,
91,NPORT,series_id,1176984_0001410368-26-020596,Eaton Vance Municipal Bond Fund,Eaton Vance Municipal Bond Fund,0001176984,,,1,780123468.1200006,0,,2026-04-15 08:10:18.206341,
277,NPORT,series_id,1396277_0001410368-25-042403,Calamos Global Dynamic Income Fund,Calamos Global Dynamic Income Fund,0001396277,,,1,774600818.0899997,0,,2026-04-15 08:10:18.206341,
1126,NPORT,series_id,883618_0000883618-26-000004,Nuveen Select Tax-Free Income Portfolio,Nuveen Select Tax-Free Income Portfolio,0000883618,,,1,773919575.8800004,0,,2026-04-15 08:10:18.206341,
5931,NPORT,series_id,0001616037_0000940400-26-012923,Pioneer ILS Interval Fund,Pioneer ILS Interval Fund,0001616037,,,1,768804684.7000003,0,,2026-04-15 10:07:22.720441,
260,NPORT,series_id,1383441_0000940400-25-014224,Virtus Equity & Convertible Income Fund,Virtus Equity & Convertible Income Fund,0001383441,,,1,768068837.2800001,0,,2026-04-15 08:10:18.206341,
385,NPORT,series_id,1560916_0001049169-25-001004,CPG Carlyle Commitments Fund LLC,CPG CARLYLE COMMITMENTS FUND LLC,0001560916,,,1,767790455.68,0,,2026-04-15 08:10:18.206341,
2601,NPORT,series_id,S000055343,Davis Select Financial ETF,Davis Fundamental ETF Trust,0001670310,,,2,767729568.6200001,0,,2026-04-15 08:10:18.206341,
738,NPORT,series_id,1886878_0001099263-26-003121,PIMCO Access Income Fund,PIMCO Access Income Fund,0001886878,,,1,758757928.2600001,0,,2026-04-15 08:10:18.206341,
737,NPORT,series_id,1886878_0001099263-25-004585,PIMCO Access Income Fund,PIMCO Access Income Fund,0001886878,,,1,757821525.6000003,0,,2026-04-15 08:10:18.206341,
345,NPORT,series_id,1515940_0001193125-25-321085,KKR Income Opportunities Fund,KKR Income Opportunities Fund,0001515940,,,1,757709279.2800006,0,,2026-04-15 08:10:18.206341,
4433,NPORT,series_id,S000083896,American Beacon GLG Natural Resources ETF,AMERICAN BEACON SELECT FUNDS,0001096012,,,2,754143361.61,0,,2026-04-15 08:10:18.206341,
4050,NPORT,series_id,S000080468,Running Oak Efficient Growth ETF,Strategic Trust,0001873280,,,2,753823738.49,0,,2026-04-15 08:10:18.206341,
16,NPORT,series_id,1051003_0001410368-26-017011,"BlackRock Debt Strategies Fund, Inc.","BlackRock Debt Strategies Fund, Inc.",0001051003,,,1,752502370.6999997,0,,2026-04-15 08:10:18.206341,
121,NPORT,series_id,1219120_0000940400-26-012586,Advent Convertible & Income Fund,ADVENT CONVERTIBLE & INCOME FUND,0001219120,,,1,750594574.0,0,,2026-04-15 08:10:18.206341,
261,NPORT,series_id,1383441_0000940400-26-012450,Virtus Equity & Convertible Income Fund,Virtus Equity & Convertible Income Fund,0001383441,,,1,749770735.05,0,,2026-04-15 08:10:18.206341,
346,NPORT,series_id,1515940_0001193125-26-117972,KKR Income Opportunities Fund,KKR Income Opportunities Fund,0001515940,,,1,749328251.6200005,0,,2026-04-15 08:10:18.206341,
120,NPORT,series_id,1219120_0000913181-25-000421,Advent Convertible and Income Fund,Advent Convertible and Income Fund,0001219120,,,1,746434003.6700001,0,,2026-04-15 08:10:18.206341,
431,NPORT,series_id,1616037_0000940400-25-014050,Pioneer ILS Interval Fund,Pioneer ILS Interval Fund,0001616037,,,1,745452643.4700001,0,,2026-04-15 08:10:18.206341,
380,NPORT,series_id,1559991_0000940400-26-002048,Flaherty & Crumrine Dynamic Preferred and Income Fund Incorporated,Flaherty & Crumrine Dynamic Preferred & Income Fund Inc,0001559991,,,1,741216636.4800001,0,,2026-04-15 08:10:18.206341,
1106,NPORT,series_id,870780_0000870780-26-000002,Nuveen Pennsylvania Quality Municipal Income Fund,Nuveen Pennsylvania Quality Municipal Income Fund,0000870780,,,1,741186906.4899995,0,,2026-04-15 08:10:18.206341,
582,NPORT,series_id,1787621_0001193125-25-321086,KKR Credit Opportunities Portfolio,KKR Credit Opportunities Portfolio,0001787621,,,1,740715044.3100004,0,,2026-04-15 08:10:18.206341,
500,NPORT,series_id,1709447_0001193125-26-076584,AIP Alternative Lending Fund A,AIP Alternative Lending Fund A,0001709447,,,1,738477086.0299976,0,,2026-04-15 08:10:18.206341,
973,NPORT,series_id,2061233_0000910472-26-003537,Morgan Stanley Private Markets & Alternative Fund,Morgan Stanley Private Markets and Alternatives,0002061233,,,1,736567533.04,0,,2026-04-15 08:10:18.206341,
187,NPORT,series_id,1281926_0001410368-26-034143,Eaton Vance Tax-Advantaged Global Dividend Opportunities Fund,Eaton Vance Tax-Advantaged Global Dividend Opportunities Fund,0001281926,,,1,735251545.4000001,0,,2026-04-15 08:10:18.206341,
710,NPORT,series_id,1865389_0001865389-25-000009,Nuveen Variable Rate Preferred & Income Fund,Nuveen Variable Rate Preferred & Income Fund,0001865389,,,1,734219743.47,0,,2026-04-15 08:10:18.206341,
116,NPORT,series_id,1215913_0001193125-25-332696,John Hancock Preferred Income Fund III,John Hancock Preferred Income Fund III,0001215913,,,1,734104792.4100001,0,,2026-04-15 08:10:18.206341,
117,NPORT,series_id,1215913_0001215913-26-000006,John Hancock Preferred Income Fund III,John Hancock Preferred Income Fund III,0001215913,,,1,731834550.8300002,0,,2026-04-15 08:10:18.206341,
711,NPORT,series_id,1865389_0001865389-26-000006,Nuveen Variable Rate Preferred & Income Fund,Nuveen Variable Rate Preferred & Income Fund,0001865389,,,1,730439401.0200006,0,,2026-04-15 08:10:18.206341,
63,NPORT,series_id,1160864_0001410368-25-032171,BlackRock Core Bond Trust,BlackRock Core Bond Trust,0001160864,,,1,727636788.0999994,0,,2026-04-15 08:10:18.206341,
