CIK,registrant_name,registration_date_proxy,most_recent_n_csr_date
9521,BANCROFT FUND LTD,2024-05-28,2025-12-08
17313,CAPITAL SOUTHWEST CORP,2021-10-27,
27367,DAXOR CORP,2025-12-29,2026-03-02
33934,CORNERSTONE TOTAL RETURN FUND INC,2025-04-08,2026-03-04
99614,TRI-CONTINENTAL CORP,2020-04-28,2026-03-06
759828,JOHN HANCOCK INVESTORS TRUST,2024-02-23,2025-12-22
786035,LIBERTY ALL STAR GROWTH FUND INC.,2021-04-28,2026-03-06
793040,ELLSWORTH GROWTH & INCOME FUND LTD,2024-01-05,2025-12-08
799195,LIBERTY ALL STAR EQUITY FUND,2021-09-27,2026-03-06
803016,CALIFORNIA FIRST LEASING Corp,2022-05-16,2026-02-17
806628,DNP SELECT INCOME FUND INC,2023-03-03,2025-12-23
809559,TCW STRATEGIC INCOME FUND INC,2025-12-18,2026-03-05
810766,"CREDIT SUISSE ASSET MANAGEMENT INCOME FUND, INC.",2024-11-14,2026-03-25
810943,HIGH INCOME SECURITIES FUND,2024-07-02,2025-11-06
813623,Total Return Securities Fund,2025-10-23,2026-03-10
814083,"Cornerstone Strategic Investment Fund, Inc.",2025-04-08,2026-03-04
818851,NUVEEN CALIFORNIA MUNICIPAL VALUE FUND,2026-04-09,2025-11-06
826020,Saba Capital Income & Opportunities Fund,2025-09-19,2026-01-02
830271,NUVEEN MUNICIPAL INCOME FUND INC,2026-04-16,2026-01-07
830487,WESTERN ASSET MUNICIPAL HIGH INCOME FUND INC.,2025-07-16,2025-12-30
832327,"BLACKROCK INCOME TRUST, INC.",2025-09-17,2026-03-05
835333,Invesco Municipal Income Opportunities Trust,2025-02-07,2025-11-07
836412,Virtus Total Return Fund Inc.,2022-07-28,2026-02-06
845611,GABELLI CONVERTIBLE & INCOME SECURITIES FUND INC,2024-09-13,2025-12-08
855886,JOHN HANCOCK PREMIUM DIVIDEND FUND,2025-04-04,2025-12-22
863900,MEXICO EQUITY & INCOME FUND INC,2021-08-06,2026-04-06
868578,FLAHERTY & CRUMRINE PREFERRED & INCOME FUND INC,2021-04-16,2026-02-04
876717,ABERDEEN GLOBAL INCOME FUND INC,2021-06-30,2026-01-08
880406,HERZFELD CARIBBEAN BASIN FUND INC,2024-06-27,2026-03-05
882071,Flaherty & Crumrine PREFERRED & INCOME OPPORTUNITY FUND INC,2021-04-16,2026-02-04
883618,NUVEEN SELECT TAX FREE INCOME PORTFOLIO,2023-06-21,2025-12-04
885732,NUVEEN CALIFORNIA SELECT TAX FREE INCOME PORTFOLIO,2023-08-01,2025-11-06
892992,NUVEEN ARIZONA QUALITY MUNICIPAL INCOME FUND,2026-04-09,2025-11-06
894242,"BLACKROCK INVESTMENT QUALITY MUNICIPAL TRUST, INC.",2022-06-02,2026-04-07
895531,Invesco California Value Municipal Income Trust,2026-01-23,2025-10-30
897419,NUVEEN MASSACHUSETTS QUALITY MUNICIPAL INCOME FUND,2026-04-09,2026-02-05
897421,NUVEEN VIRGINIA QUALITY MUNICIPAL INCOME FUND,2025-11-19,2026-02-05
897802,"SPECIAL OPPORTUNITIES FUND, INC.",2021-12-08,2026-03-10
901243,"BLACKROCK MUNIASSETS FUND, INC.",2021-08-24,2026-04-07
910068,WESTERN ASSET HIGH INCOME OPPORTUNITY FUND INC.,2026-03-09,2025-11-26
917100,"INDIA FUND, INC.",2024-04-03,2026-03-09
919567,"RENN Fund, Inc.",2021-12-03,2026-03-09
921671,GABELLI MULTIMEDIA TRUST INC.,2024-04-15,2026-03-09
925683,JOHN HANCOCK FINANCIAL OPPORTUNITIES FUND,2024-06-24,2026-02-26
1051003,"BLACKROCK DEBT STRATEGIES FUND, INC.",2026-02-04,2026-03-05
1058239,WESTERN ASSET HIGH INCOME FUND II INC.,2025-09-19,2025-12-30
1059386,Invesco Senior Income Trust,2025-02-07,2025-11-07
1061353,CREDIT SUISSE HIGH YIELD CREDIT FUND,2026-04-02,2026-01-09
1070732,EATON VANCE SENIOR INCOME TRUST,2022-08-22,2026-02-27
1074540,EATON VANCE MUNICIPAL INCOME TRUST,2023-03-22,2026-01-27
1074769,NUVEEN NEW YORK QUALITY MUNICIPAL INCOME FUND,2025-08-06,2025-11-06
1080720,GABELLI UTILITY TRUST,2023-12-28,2026-03-09
1099941,"MVC CAPITAL, INC.",2020-04-16,
1137393,BLACKROCK MUNICIPAL INCOME TRUST,2022-03-16,2026-04-07
1140392,PIMCO MUNICIPAL INCOME FUND,2023-08-14,2025-09-05
1140411,PIMCO CALIFORNIA MUNICIPAL INCOME FUND,2022-09-30,2026-03-05
1143513,GLADSTONE CAPITAL CORP,2024-01-12,
1157842,COHEN & STEERS QUALITY INCOME REALTY FUND INC,2020-01-07,2026-03-06
1160864,BLACKROCK CORE BOND TRUST,2025-05-09,2026-03-05
1160990,PIMCO CORPORATE & INCOME STRATEGY FUND,2024-02-09,2026-03-05
1166258,"PIONEER HIGH INCOME FUND, INC.",2021-09-17,2025-12-05
1169578,AETOS DISTRESSED INVESTMENT STRATEGIES FUND LLC,2026-03-27,2026-04-02
1169580,AETOS MULTI-STRATEGY ARBITRAGE FUND LLC,2026-03-27,2026-04-02
1169583,AETOS LONG/SHORT STRATEGIES FUND LLC,2026-03-27,2026-04-02
1170299,PIMCO MUNICIPAL INCOME FUND II,2023-08-31,2026-03-05
1170300,PIMCO CALIFORNIA MUNICIPAL INCOME FUND II,2022-09-30,2025-09-05
1181504,PIMCO CALIFORNIA MUNICIPAL INCOME FUND III,2022-10-03,2025-09-05
1181506,PIMCO MUNICIPAL INCOME FUND III,2023-08-14,2025-09-05
1181848,SKYBRIDGE OPPORTUNITY FUND,2025-07-29,2025-12-05
1186641,A&Q Long/Short Strategies Fund LLC,2026-04-30,2026-03-06
1190935,PIMCO CORPORATE & INCOME OPPORTUNITY FUND,2020-11-24,2026-03-05
1195738,NUVEEN CALIFORNIA AMT-FREE QUALITY MUNICIPAL INCOME FUND,2026-01-13,2025-11-06
1214935,AllianzGI Convertible & Income Fund,2020-06-02,2026-04-09
1219120,ADVENT CONVERTIBLE & INCOME FUND,2024-08-30,2025-12-29
1227857,AllianzGI Convertible & Income Fund II,2020-06-02,2026-04-09
1228509,WESTERN ASSET GLOBAL HIGH INCOME FUND INC.,2024-03-07,2026-01-28
1232860,"BLACKROCK MUNICIPAL INCOME FUND, INC.",2025-03-24,2026-04-07
1233087,FRANKLIN LTD DURATION INCOME TRUST,2021-11-10,2026-03-04
1233681,BLACKROCK Ltd DURATION INCOME TRUST,2025-08-01,2026-03-05
1244183,PIMCO INCOME STRATEGY FUND,2024-02-09,2026-03-05
1245648,FLAHERTY & CRUMRINE TOTAL RETURN FUND INC,2021-04-16,2026-02-04
1258623,EATON VANCE SENIOR FLOATING RATE TRUST,2023-03-02,2025-12-30
1259429,Oxford Square Capital Corp.,2026-04-17,
1259708,"BLACKROCK FLOATING RATE INCOME STRATEGIES FUND, INC.",2025-10-31,2026-03-05
1260729,GABELLI DIVIDEND & INCOME TRUST,2024-08-16,2026-03-04
1261166,NEUBERGER REAL ESTATE SECURITIES INCOME FUND INC,2026-03-17,2026-01-02
1263994,REAVES UTILITY INCOME FUND,2021-11-22,2026-01-06
1266585,NUVEEN MUNICIPAL HIGH INCOME OPPORTUNITY FUND,2020-02-27,2026-01-07
1270131,LMP CAPITAL & INCOME FUND INC.,2025-03-13,2026-01-28
1278752,APOLLO INVESTMENT CORP,2020-07-14,
1281926,Eaton Vance Tax-Advantaged Global Dividend Opportunities Fun,2023-03-02,2025-12-30
1282957,GABELLI GLOBAL UTILITY & INCOME TRUST,2024-08-16,2026-03-09
1284940,FIRST TRUST ENERGY INCOME & GROWTH FUND,2022-10-11,2024-02-08
1285650,CALAMOS GLOBAL TOTAL RETURN FUND,2021-02-26,2025-12-29
1287032,PROSPECT CAPITAL CORP,2020-02-13,
1287480,BLACKROCK FLOATING RATE INCOME TRUST,2026-02-20,2026-03-05
1287750,ARES CAPITAL CORP,2020-09-16,
1288795,Clough Global Dividend & Income Fund,2022-08-10,2026-01-06
1288992,Eaton Vance Floating-Rate Income Trust,2022-09-27,2026-01-27
1289868,XAI Madison Equity Premium Income Fund,2026-03-06,2025-12-01
1296250,PIMCO Income Strategy Fund II,2024-04-19,2026-03-05
1308927,Eaton Vance Tax-Managed Buy-Write Income Fund,2023-04-28,2026-02-27
1313510,"GAMCO Global Gold, Natural Resources & Income Trust",2024-04-15,2026-03-09
1314966,BlackRock Health Sciences Trust,2022-04-21,2026-03-05
1316463,Clough Global Equity Fund,2021-05-21,2026-01-06
1321741,GLADSTONE INVESTMENT CORPORATION\DE,2024-02-28,
1322435,Eaton Vance Tax-Managed Global Buy-Write Opportunities Fund,2021-06-21,2026-02-27
1322436,Eaton Vance Tax-Managed Buy-Write Opportunities Fund,2020-04-20,2026-02-27
1326003,BlackRock Capital Investment Corp,2022-05-19,
1327228,Alternative Investment Partners Absolute Return Fund,2025-04-29,2026-03-06
1338561,Nuveen S&P 500 Dynamic Overwrite Fund,2025-03-21,2026-03-06
1343668,Alternative Investment Partners Absolute Return Fund STS,2025-04-29,2026-03-06
1350869,Clough Global Opportunities Fund,2021-05-21,2026-01-06
1362481,abrdn Global Dynamic Dividend Fund,2025-10-10,2026-01-08
1370755,BlackRock TCP Capital Corp.,2022-09-23,
1372807,Portman Ridge Finance Corp,2025-02-05,
1377936,SARATOGA INVESTMENT CORP.,2026-03-06,
1378701,GDL FUND,2024-07-05,2026-03-09
1380936,GUGGENHEIM STRATEGIC OPPORTUNITIES FUND,2021-09-17,2026-02-03
1383414,PENNANTPARK INVESTMENT CORP,2022-04-20,
1385763,Nuveen Core Equity Alpha Fund,2024-07-17,2026-03-06
1390195,abrdn Global Premier Properties Fund,2024-12-11,2026-01-08
1391437,Gabelli Healthcare & WellnessRx Trust,2024-05-28,2026-03-09
1396277,Calamos Global Dynamic Income Fund,2021-08-06,2025-12-29
1396502,John Hancock Tax-Advantaged Global Shareholder Yield Fund,2024-02-23,2023-12-27
1400897,NXG Cushing Midstream Energy Fund,2025-10-22,2026-02-09
1412350,PIMCO Income Opportunity Fund,2021-02-09,2022-03-07
1418076,SLR Investment Corp.,2021-04-30,
1438893,"GAMCO Natural Resources, Gold & Income Trust",2024-01-17,2026-03-09
1447247,"Partners Group Private Equity Fund, LLC",2025-12-29,2025-12-29
1454741,Eaton Vance National Municipal Opportunities Trust,2022-07-21,2025-11-26
1464963,"First Eagle Alternative Capital BDC, Inc.",2020-12-03,
1467631,ACAP Strategic Fund,2021-01-20,2025-12-01
1471420,"Columbia Seligman Premium Technology Growth Fund, Inc.",2024-11-13,2026-03-06
1475456,"GROSVENOR REGISTERED MULTI-STRATEGY FUND (TI 2), LLC",2025-08-25,2025-12-08
1475457,"GROSVENOR REGISTERED MULTI-STRATEGY FUND (TI 1), LLC",2025-07-25,2025-12-08
1478102,Western Asset Mortgage Opportunity Fund Inc.,2024-08-27,2026-03-02
1478888,Nuveen Taxable Municipal Income Fund,2024-07-12,2025-12-04
1486298,Blackstone Senior Floating Rate Term Fund,2022-01-21,2026-03-06
1487428,Horizon Technology Finance Corp,2024-06-07,
1487610,Neuberger Berman High Yield Strategies Fund Inc.,2025-04-07,2025-12-30
1487918,OFS Capital Corp,2024-05-24,
1490349,PhenixFIN Corp,2021-10-15,
1495222,Oxford Lane Capital Corp.,2023-10-04,2025-11-05
1495825,Guggenheim Taxable Municipal Bond & Investment Grade Debt Tr,2026-04-03,2026-02-03
1496099,New Mountain Finance Corp,2023-05-17,
1497186,Western Asset High Yield Opportunity Fund Inc.,2026-03-31,2026-01-29
1500233,Ironwood Institutional Multi-Strategy Fund LLC,2025-08-27,2025-12-29
1500234,Ironwood Multi-Strategy Fund LLC,2025-08-27,2025-12-29
1501072,"RIVERNORTH OPPORTUNITIES FUND, INC.",2026-02-10,2026-03-06
1501103,Virtus Stone Harbor Emerging Markets Income Fund,2024-10-25,2026-02-06
1502573,Apollo Senior Floating Rate Fund Inc.,2022-05-24,2024-08-07
1503290,abrdn Income Credit Strategies Fund,2024-05-10,2026-01-08
1504234,Blackstone Long-Short Credit Income Fund,2021-07-29,2026-03-06
1504619,PennantPark Floating Rate Capital Ltd.,2024-07-15,
1506488,NXG NextGen Infrastructure Income Fund,2025-06-23,2026-02-09
1506707,A&Q Multi-Strategy Fund,2024-07-29,2025-12-05
1508171,SLR Senior Investment Corp.,2021-06-25,
1509470,SURO CAPITAL CORP.,2023-08-16,
1510599,PIMCO Dynamic Income Fund,2020-11-20,2026-03-05
1512931,MONROE CAPITAL Corp,2023-09-21,
1513363,FIDUS INVESTMENT Corp,2024-05-08,
1515001,Versus Capital Multi-Manager Real Estate Income Fund LLC,2022-07-22,2025-12-03
1515324,"Ares Dynamic Credit Allocation Fund, Inc.",2024-08-15,2026-03-06
1515940,KKR Income Opportunities Fund,2024-03-12,2025-12-22
1517767,Carlyle Credit Income Fund,2023-09-28,2025-11-18
1520568,Skybridge G II Fund,2025-07-29,2025-12-05
1521404,BARINGS GLOBAL SHORT DURATION HIGH YIELD FUND,2026-01-27,2026-03-09
1521945,"Prospect Floating Rate & Alternative Income Fund, Inc.",2024-04-08,
1525201,DoubleLine Opportunistic Credit Fund,2023-09-27,2025-11-28
1526697,Apollo Tactical Income Fund Inc.,2022-05-24,2024-08-07
1528988,"BlackRock Utilities, Infrastructure & Power Opportunities Tr",2025-05-23,2026-03-05
1534254,CION Investment Corp,2024-06-14,
1535778,"MSC INCOME FUND, INC.",2025-01-21,
1539337,Nuveen Real Asset Income & Growth Fund,2026-01-21,2026-03-06
1543188,AB Multi-Manager Alternative Fund,2023-07-28,2025-12-05
1544206,"TCG BDC, INC.",2021-04-29,
1551047,Bluerock Total Income (plus) Real Estate Fund,2021-01-28,2025-12-08
1551901,Stellus Capital Investment Corp,2025-08-04,
1552198,"WhiteHorse Finance, Inc.",2022-07-27,
1554625,"Priority Income Fund, Inc.",2025-03-26,2026-02-27
1558629,PIMCO Dynamic Credit & Mortgage Income Fund,2020-10-27,2022-03-07
1559991,Flaherty & Crumrine Dynamic Preferred & Income Fund Inc,2021-04-16,2026-02-04
1560672,Ellington Credit Co,2026-04-16,2025-11-21
1562818,BlackRock Multi-Sector Income Trust,2025-05-23,2026-03-05
1566388,DoubleLine Income Solutions Fund,2020-09-30,2025-11-28
1571329,Logan Ridge Finance Corp.,2021-12-20,
1572694,"Goldman Sachs BDC, Inc.",2020-11-19,
1577134,"Terra Income Fund 6, Inc.",2021-02-02,
1577791,Oaktree Strategic Income Corp,2020-06-26,
1578348,"Investcorp Credit Management BDC, Inc.",2021-10-27,
1578987,ArrowMark Financial Corp.,2025-02-13,2026-03-06
1580345,TriplePoint Venture Growth BDC Corp.,2024-04-15,
1585855,Gabelli Global Small & Mid Cap Value Trust,2024-08-16,2026-03-09
1587987,Newtek Business Services Corp.,2020-06-08,
1588474,INFINITY CORE ALTERNATIVE FUND,2023-07-28,2025-12-05
1588807,Blackstone Real Estate Income Fund,2020-04-21,2021-09-07
1589029,Blackstone Real Estate Income Fund II,2020-04-21,2021-09-07
1589390,North Square Evanston Multi-Alpha Fund,2025-07-25,2025-12-09
1597634,Griffin Institutional Access Real Estate Fund,2020-01-31,2025-12-05
1602584,Calamos Dynamic Convertible & Income Fund,2025-05-21,2025-12-29
1604174,Eagle Point Credit Co Inc.,2023-06-09,2026-02-26
1606789,iDirect Private Markets Fund,2024-07-26,2025-12-08
1607997,Nuveen Minnesota Quality Municipal Income Fund,2024-11-20,2026-02-05
1609211,"AMG Pantheon Fund, LLC",2025-07-29,2025-12-08
1609706,CROSS SHORE DISCOVERY FUND,2022-07-25,2024-12-06
1615905,Nuveen Global High Income Fund,2025-08-15,2026-03-06
1616203,Pomona Investment Fund,2025-07-01,2025-12-05
1620515,Princeton Everest Fund,2022-12-13,2025-12-09
1633336,"Crescent Capital BDC, Inc.",2025-07-14,
1635977,abrdn World Healthcare Fund,2025-12-05,2025-12-08
1644771,"RiverNorth Capital & Income Fund, Inc.",2025-03-21,2026-03-06
1649363,ABS Long/Short Strategies Fund,2021-04-27,2026-01-02
1653384,Runway Growth Finance Corp.,2025-03-19,
1655050,"Bain Capital Specialty Finance, Inc.",2021-02-09,
1655099,Brookfield Real Assets Income Fund Inc.,2024-04-11,2026-03-06
1655888,Owl Rock Capital Corp,2020-07-09,
1674786,GUGGENHEIM CREDIT INCOME FUND 2021,2020-08-20,
1675033,Great Elm Capital Corp.,2026-02-19,
1677615,Federated Hermes Project & Trade Finance Tender Fund,2025-11-25,2025-11-24
1678124,CION Ares Diversified Credit Fund,2023-05-01,2026-03-06
1678130,"RiverNorth/DoubleLine Strategic Opportunity Fund, Inc.",2025-03-21,2026-03-06
1682662,Peachtree Alternative Strategies Fund,2025-08-28,2026-01-09
1682692,"Partners Group Private Income Opportunities, LLC",2020-07-02,2020-12-02
1687898,Versus Capital Real Assets Fund LLC,2021-11-23,2025-12-03
1688554,PIMCO Flexible Credit Income Fund,2020-02-26,2026-03-05
1703079,XAI Octagon Floating Rate & Alternative Income Trust,2025-06-16,2025-12-01
1706411,IBAA Fund,2020-02-13,
1709406,AIP Alternative Lending Fund P,2025-01-29,2025-12-05
1709447,AIP Alternative Lending Fund A,2025-01-29,2025-12-05
1716951,"OFS Credit Company, Inc.",2024-05-24,2025-12-10
1732078,Flat Rock Opportunity Fund,2020-04-30,2026-03-06
1735964,Cliffwater Corporate Lending Fund,2026-02-19,2025-12-05
1736035,Blackstone Secured Lending Fund,2021-10-18,
1736510,Variant Alternative Income Fund,2021-08-27,2026-01-09
1737924,Nuveen Churchill Direct Lending Corp.,2024-01-16,
1738008,Hedge Fund Guided Portfolio Solution,2025-07-25,2025-12-08
1741739,FlowStone Opportunity Fund,2024-07-26,2025-12-05
1742951,John Hancock GA Senior Loan Trust,2020-11-19,2026-03-06
1745059,Angel Oak Financial Strategies Income Term Trust,2024-11-12,2026-04-08
1746967,"RiverNorth Opportunistic Municipal Income Fund, Inc.",2025-03-31,2026-03-06
1747172,"Kayne Anderson BDC, Inc.",2025-02-14,
1747777,Owl Rock Technology Finance Corp.,2021-06-07,
1752019,BlackRock Credit Strategies Fund,2021-05-10,2026-03-05
1753712,Lord Abbett Credit Opportunities Fund,2022-02-04,2026-03-04
1754836,Eagle Point Income Co Inc.,2024-11-27,2026-02-26
1757563,Loomis Sayles Credit Income Opportunities Fund,2026-04-28,
1758583,Arca U.S. Treasury Fund,2020-06-25,2026-03-09
1759455,ALTI PRIVATE EQUITY ACCESS & COMMITMENTS FUND,2023-08-18,2024-06-07
1762229,YieldStreet Prism Fund Inc.,2023-04-28,2026-03-11
1762562,Clarion Partners Real Estate Income Fund Inc.,2025-04-30,2026-02-27
1767074,CIM Real Assets & Credit Fund,2020-04-20,2025-12-08
1771226,"RiverNorth Managed Duration Municipal Income Fund, Inc.",2025-03-31,2026-03-06
1774342,Nuveen Municipal Credit Opportunities Fund,2026-03-10,2026-01-07
1777482,Nuveen Enhanced High Yield Municipal Bond Fund,2021-06-22,2025-12-04
1777677,"Fundrise Real Estate Interval Fund, LLC",2020-12-17,2026-02-26
1778756,AIP Private Equity Opportunities Fund I P LP,2020-07-24,
1780133,Stone Ridge Longevity Risk Premium Fixed Income Trust 65F,2020-03-09,
1782524,Morgan Stanley Direct Lending Fund,2024-01-19,
1783964,Accordant ODCE Index Fund,2023-09-05,2026-03-05
1785971,BlackRock Health Sciences Trust II,2020-01-28,2026-03-05
1786108,Trinity Capital Inc.,2025-01-17,
1787621,KKR Credit Opportunities Portfolio,2020-02-20,2025-12-22
1788399,DoubleLine Yield Opportunities Fund,2023-09-26,2025-11-28
1788420,Keystone Private Income Fund,2026-01-09,2025-12-08
1789470,StepStone Private Markets,2025-08-19,2025-12-02
1790177,"RiverNorth Flexible Municipal Income Fund, Inc.",2025-03-31,2026-03-06
1792037,Pioneer Multi-Asset Income Trust,2020-05-07,
1793101,Bluerock Institutional High Income Credit Fund,2020-02-24,
1793129,Nuveen Dynamic Municipal Opportunities Fund,2024-08-22,2026-01-07
1793289,Astor Dynamic Credit Fund,2020-02-20,
1793855,Aberdeen Standard Global Infrastructure Income Fund,2020-07-28,2025-12-08
1793882,Cohen & Steers Tax-Advantaged Preferred Securities & Income,2020-10-26,2025-12-29
1794041,Franklin BSP Private Credit Fund,2022-09-28,2026-03-09
1794287,Angel Oak Dynamic Financial Strategies Income Term Trust,2020-06-25,2022-04-11
1794776,Palmer Square Capital BDC Inc.,2024-09-27,
1796233,Goldman Sachs Credit Income Fund,2020-02-19,
1796242,Goldman Sachs Real Estate Diversified Income Fund,2020-02-19,2025-12-05
1798618,PIMCO Dynamic Income Opportunities Fund,2021-01-26,2026-03-05
1802293,Lord Abbett Floating Rate High Income Fund,2022-09-23,2025-03-06
1802356,Yleana Bitcoin Strategy Fund,2020-02-07,
1803491,Hamilton Lane Private Assets Fund,2025-07-29,2025-12-05
1803498,Blackstone Private Credit Fund,2026-05-01,
1803958,KKR Real Estate Select Trust Inc.,2026-01-27,2026-03-03
1804263,Stone Ridge Longevity Risk Premium Fixed Income Trust 85M,2020-03-09,
1804267,Stone Ridge Longevity Risk Premium Fixed Income Trust 85F,2020-03-09,
1804269,Stone Ridge Longevity Risk Premium Fixed Income Trust 84M,2020-03-09,
1804270,Stone Ridge Longevity Risk Premium Fixed Income Trust 84F,2020-03-09,
1804272,Stone Ridge Longevity Risk Premium Fixed Income Trust 83M,2020-03-09,
1804274,Stone Ridge Longevity Risk Premium Fixed Income Trust 83F,2020-03-09,
1804276,Stone Ridge Longevity Risk Premium Fixed Income Trust 82M,2020-03-09,
1804278,Stone Ridge Longevity Risk Premium Fixed Income Trust 82F,2020-03-09,
1804280,Stone Ridge Longevity Risk Premium Fixed Income Trust 81M,2020-03-09,
1804282,Stone Ridge Longevity Risk Premium Fixed Income Trust 81F,2020-03-09,
1804283,Stone Ridge Longevity Risk Premium Fixed Income Trust 80M,2020-03-09,
1804287,Stone Ridge Longevity Risk Premium Fixed Income Trust 80F,2020-03-09,
1804288,Stone Ridge Longevity Risk Premium Fixed Income Trust 79M,2020-03-09,
1804289,Stone Ridge Longevity Risk Premium Fixed Income Trust 79F,2020-03-09,
1804290,Stone Ridge Longevity Risk Premium Fixed Income Trust 78M,2020-03-09,
1804291,Stone Ridge Longevity Risk Premium Fixed Income Trust 78F,2020-03-09,
1804292,Stone Ridge Longevity Risk Premium Fixed Income Trust 77M,2020-03-09,
1804293,Stone Ridge Longevity Risk Premium Fixed Income Trust 77F,2020-03-09,
1804294,Stone Ridge Longevity Risk Premium Fixed Income Trust 76M,2020-03-09,
1804295,Stone Ridge Longevity Risk Premium Fixed Income Trust 76F,2020-03-09,
1804298,Stone Ridge Longevity Risk Premium Fixed Income Trust 75M,2020-03-09,
1804299,LifeX Income Trust 1948F,2023-10-06,
1804301,Stone Ridge Longevity Risk Premium Fixed Income Trust 74M,2020-03-09,
1804302,Stone Ridge Longevity Risk Premium Fixed Income Trust 74F,2020-03-09,
1804304,Stone Ridge Longevity Risk Premium Fixed Income Trust 73M,2020-03-09,
1804305,Stone Ridge Longevity Risk Premium Fixed Income Trust 73F,2020-03-09,
1804306,Stone Ridge Longevity Risk Premium Fixed Income Trust 72M,2020-03-09,
1804308,Stone Ridge Longevity Risk Premium Fixed Income Trust 72F,2020-03-09,
1804309,Stone Ridge Longevity Risk Premium Fixed Income Trust 71M,2020-03-09,
1804310,Stone Ridge Longevity Risk Premium Fixed Income Trust 71F,2020-03-09,
1804311,Stone Ridge Longevity Risk Premium Fixed Income Trust 70M,2020-03-09,
1804312,Stone Ridge Longevity Risk Premium Fixed Income Trust 70F,2020-03-09,
1804313,Stone Ridge Longevity Risk Premium Fixed Income Trust 69M,2020-03-09,
1804314,Stone Ridge Longevity Risk Premium Fixed Income Trust 69F,2020-03-09,
1804315,Stone Ridge Longevity Risk Premium Fixed Income Trust 68M,2020-03-09,
1804316,Stone Ridge Longevity Risk Premium Fixed Income Trust 68F,2020-03-09,
1804317,Stone Ridge Longevity Risk Premium Fixed Income Trust 67M,2020-03-09,
1804318,Stone Ridge Longevity Risk Premium Fixed Income Trust 67F,2020-03-09,
1804319,Stone Ridge Longevity Risk Premium Fixed Income Trust 66M,2020-03-09,
1804320,Stone Ridge Longevity Risk Premium Fixed Income Trust 66F,2020-03-09,
1804321,Stone Ridge Longevity Risk Premium Fixed Income Trust 65M,2020-03-09,
1804325,Stone Ridge Longevity Risk Premium Fixed Income Master Trust,2020-03-09,
1804355,Reaves Sustainable Infrastructure Fund,2020-02-24,
1805262,FIRST TRUST SKYBRIDGE INCOME FUND,2020-03-06,
1806678,BNY Mellon Alcentra Global Credit Income Fund,2020-08-05,
1807090,LifeX Inflation-Protected Income Trust 1948F,2023-12-28,
1807272,Delaware Wilshire Private Markets Tender Fund,2024-03-28,2024-06-07
1807333,Delaware Wilshire Private Markets Master Fund,2020-09-15,2025-12-08
1807334,Delaware Wilshire Private Markets Fund,2024-03-28,2025-12-08
1808251,Entoro Gray Swan Fund,2022-03-08,
1808519,Stone Ridge Investment Grade Income Longevity Trust 2045 65F,2020-04-10,
1809051,Zell Capital,2021-05-11,2022-12-09
1809541,BlackRock Capital Allocation Trust,2020-09-24,2026-03-05
1810256,Bow River Capital Evergreen Fund,2020-12-23,2025-12-05
1810523,FIRST TRUST HIGH YIELD OPPORTUNITIES 2027 TERM FUND,2020-06-25,2026-02-09
1811114,"BBR ALO Fund, LLC",2020-05-01,2025-12-05
1812284,Eaton Vance Income Opportunities Fund - MA,2020-05-19,
1812286,Versus Capital Infrastructure Income Fund,2024-02-26,2025-12-03
1812469,Calamos-Avenue Opportunities Fund,2022-01-12,
1812554,Blue Owl Credit Income Corp.,2025-08-21,
1812923,PGIM Short Duration High Yield Opportunities Fund,2020-11-23,2026-03-27
1813467,PGIM Strategic Credit Fund,2020-05-29,
1814390,Flat Rock Core Income Fund,2020-11-19,2026-03-06
1814902,"RiverNorth Global Innovation Opportunities Fund, Inc.",2020-06-12,
1815609,Primark Private Equity Fund,2020-08-24,2025-12-05
1816314,BNY Mellon Alcentra Opportunistic Global Credit Income Fund,2021-09-10,2022-11-23
1816389,BlackRock Private Investments Fund,2023-07-28,2025-12-03
1816940,OATH Advisors Partner Fund,2020-08-07,
1817159,"RiverNorth Flexible Municipal Income Fund II, Inc.",2025-03-31,2026-03-06
1817488,Calvert High Income Term Trust,2020-07-10,
1817518,Calvert High Income Municipal Term Trust,2020-07-10,
1818105,NB Private Markets Access Fund LLC,2025-07-29,2025-11-24
1818255,"CPG Cooper Square International Equity, LLC",2020-10-01,2024-06-07
1818416,First Eagle Credit Opportunities Fund,2020-11-25,2026-03-06
1819559,Western Asset Diversified Income Fund,2021-06-24,2026-03-02
1820378,Thornburg Income Builder Opportunities Trust,2021-07-27,2025-11-24
1824796,Destiny Alternative Fund LLC,2022-07-01,2025-12-08
1826222,"CPG Vintage Access Fund IV, LLC",2020-09-25,2025-12-05
1830921,ASPIRIANT RISK-MANAGED REAL ASSETS FUND,2023-07-28,2025-12-05
1830926,EMERY PARTNERS INCOME CREDIT STRATEGIES FUND,2026-02-04,2026-03-06
1830974,ASPIRIANT RISK-MANAGED CAPITAL APPRECIATION FUND,2023-07-28,2025-12-05
1832871,BlackRock 2037 Municipal Target Term Trust,2026-03-26,2026-03-05
1833936,BlackRock Hedge Fund Guided Portfolio Solution,2023-07-28,2025-12-03
1835068,Nuveen Core Plus Impact Fund,2021-04-27,2026-03-06
1835531,Tax-Free High Grade Portfolio Target Maturity Fund for Puert,2022-07-12,2026-03-06
1836057,BlackRock Innovation & Growth Trust,2021-03-25,2026-03-05
1836804,Calamos Hunt Alternative Income Fund,2021-04-07,
1837532,Apollo Debt Solutions BDC,2026-04-21,
1838126,HPS Corporate Lending Fund,2026-04-24,
1842754,Cliffwater Enhanced Lending Fund,2021-06-11,2025-12-05
1843162,Silver Spike Investment Corp.,2022-02-02,
1843181,Neuberger Berman Next Generation Connectivity Fund Inc.,2021-05-25,2026-01-02
1843305,Angel Oak Credit Opportunities Term Trust,2021-01-29,
1843499,AFA Multi-Manager Credit Fund,2021-05-10,2026-01-09
1843974,Destiny Tech100 Inc.,2025-07-10,2026-03-10
1843995,"Puerto Rico Residents Tax-Free Fund, Inc.",2022-06-24,2025-05-08
1844499,Basquet Global Debt Fund,2021-05-07,
1844684,NC SLF Inc.,2022-08-12,2026-02-27
1844890,Finite Solar Finance Fund,2021-11-19,2023-06-07
1847281,Tax-Free High Grade Portfolio Bond Fund II for Puerto Rico R,2022-05-02,2026-03-06
1847282,Tax-Free High Grade Portfolio Bond Fund for Puerto Rico Resi,2022-05-02,2025-12-05
1847283,"Puerto Rico Residents Tax-Free Fund VI, Inc.",2022-06-24,2025-03-07
1847284,"Puerto Rico Residents Tax-Free Fund V, Inc.",2022-06-24,2026-04-08
1847286,"Puerto Rico Residents Tax-Free Fund IV, Inc.",2022-06-24,2025-11-06
1847287,"Puerto Rico Residents Tax-Free Fund III, Inc.",2022-06-24,2025-11-06
1847288,"Puerto Rico Residents Tax-Free Fund II, Inc.",2022-06-24,2025-11-06
1847290,Puerto Rico Residents Bond Fund I,2022-06-24,2025-12-05
1847302,"Tax-Free Fixed Income Fund II for Puerto Rico Residents, Inc",2022-05-03,2025-12-05
1847303,GNMA & US Government Target Maturity Fund for Puerto Rico Re,2022-05-02,2025-12-05
