CIK,registrant_name,registration_date_proxy,most_recent_n_csr_date
1847304,"Tax-Free Fixed Income Fund III for Puerto Rico Residents, In",2022-05-03,2026-03-06
1847305,"Tax-Free Fixed Income Fund IV for Puerto Rico Residents, Inc",2022-05-03,2025-12-05
1847307,"Tax-Free Fixed Income Fund V for Puerto Rico Residents, Inc.",2022-05-02,2025-12-05
1847308,"Tax-Free Fixed Income Fund VI for Puerto Rico Residents, Inc",2021-11-04,2025-12-05
1847309,"US Mortgage-Backed & Income Fund for Puerto Rico Residents,",2021-11-04,2025-12-05
1847516,"Tax Free Target Maturity Fund for Puerto Rico Residents, Inc",2022-05-03,2026-03-06
1847517,"Tax Free Fund II for Puerto Rico Residents, Inc.",2022-05-03,2025-12-05
1847518,"Tax Free Fund for Puerto Rico Residents, Inc.",2022-05-03,2025-09-25
1848566,Optima Dynamic Alternatives Fund,2021-05-18,
1850862,"Tax-Free Fixed Income Fund for Puerto Rico Residents, Inc.",2022-05-03,2026-03-06
1851077,PIMCO Flexible Emerging Markets Income Fund,2021-07-27,2026-03-05
1851265,NB Crossroads Private Markets Fund VII LP,2021-03-17,2025-12-08
1851280,"RiverNorth SPAC Focus Fund, Inc.",2021-03-24,
1851515,NB Crossroads Private Markets Fund VII Holdings LP,2021-10-25,2025-12-08
1854370,Thirdline Real Estate Income Fund,2021-09-02,2025-12-08
1854919,Dynamic Alternatives Fund,2026-01-28,2025-12-09
1855066,MainStay CBRE Global Infrastructure Megatrends Fund,2021-10-26,2026-02-02
1855299,Lord Abbett Special Situations Income Fund,2022-04-25,2026-03-04
1856156,FS MVP Private Markets Fund,2025-07-29,2025-12-04
1857314,Forum Real Estate Income Fund,2022-09-26,2026-03-10
1857563,Cohen & Steers Select Infrastructure Income Fund,2021-04-22,
1858660,USVC Venture Capital Access Fund,2025-10-09,
1858982,ECP Essential Infrastructure Income Fund,2021-05-07,
1860151,Invesco Dynamic Credit Opportunity Fund,2021-07-20,2025-11-07
1861115,Nuveen Multi-Asset Income Fund,2021-06-30,2026-03-06
1862281,ADAMS STREET PRIVATE EQUITY NAVIGATOR FUND LLC,2025-06-30,2025-12-01
1864208,Guggenheim Active Allocation Fund,2021-11-23,2026-02-03
1864290,"Pioneer Municipal High Income Opportunities Fund, Inc.",2021-08-04,2026-01-06
1864609,Cascade Private Capital Fund,2024-05-10,2025-12-05
1864843,BlackRock ESG Capital Allocation Trust,2021-09-27,2026-03-05
1865266,Equal Access Portfolio LLC,2021-09-03,
1865389,Nuveen Variable Rate Preferred & Income Fund,2021-12-14,2026-04-02
1866188,DoubleLine Shiller CAPE Enhanced Income Fund,2022-05-26,
1866874,Cohen & Steers Real Estate Opportunities & Income Fund,2022-02-23,2026-03-06
1867090,"Fundrise Growth Tech Fund, LLC",2024-07-29,2025-11-24
1867714,Monachil Credit Income Fund,2022-10-28,2026-03-09
1868950,Sweater Cashmere Fund,2022-04-05,2025-12-08
1869040,Lind Capital Partners Municipal Credit Income Fund,2022-02-02,2026-04-10
1869453,Blue Owl Technology Income Corp.,2025-04-16,
1870714,Oaktree Diversified Income Fund Inc.,2021-10-22,2026-03-06
1870833,"RiverNorth Managed Duration Municipal Income Fund II, Inc.",2025-03-31,2026-03-06
1871717,Calamos Global Convertible & Dynamic Income Trust,2022-03-29,
1872371,Oaktree Strategic Credit Fund,2024-12-31,
1874331,Virtus AllianzGI Smart Cities Fund Inc.,2021-07-23,
1875084,"PGIM Private Real Estate Fund, Inc.",2025-04-30,2026-03-06
1875224,"Altmore BDC, Inc.",2022-02-11,
1876006,Ares Private Markets Fund,2025-07-29,2025-12-05
1876160,First Eagle Global Opportunities Fund,2022-10-11,
1876813,"CPG Vintage Access Fund V, LLC",2021-08-13,2025-12-05
1877967,Fairway Private Equity & Venture Capital Opportunities Fund,2024-07-26,2025-12-09
1881739,Variant Impact Fund,2021-11-24,2026-01-09
1883728,Alpha Alternative Assets Fund,2021-10-01,
1884434,"Panagram Capital, LLC",2023-09-11,
1885551,"Fundrise Income Real Estate Fund, LLC",2022-01-31,2026-02-26
1885778,John Hancock Asset-Based Lending Fund,2024-09-27,2025-12-30
1886683,abrdn Global Climate Infrastructure Fund,2022-03-04,
1886878,PIMCO Access Income Fund,2024-12-23,2026-03-05
1887499,NB Crossroads Private Markets Fund VII Advisory LP,2021-11-16,2025-12-08
1890107,First Eagle Private Credit Fund,2026-04-30,
1890380,Impact Shares Climate Risk Reinsurance Corp,2021-10-28,
1892443,Bluerock High Income Institutional Credit Fund,2022-05-27,2025-12-08
1896036,Eagle Point Institutional Income Fund,2025-04-17,2026-03-04
1896329,PIMCO Flexible Real Estate Income Fund,2022-11-09,2026-03-26
1897540,AOG Institutional Diversified Fund,2023-01-11,2025-12-08
1897593,AOG Institutional Diversified Master Fund,2021-12-16,2023-12-08
1897690,AOG Institutional Diversified Tender Fund,2023-01-11,
1898303,First Trust Real Assets Fund,2022-06-17,2025-12-05
1899017,Bain Capital Private Credit,2026-04-30,
1899194,Franklin Income Opportunities Fund,2022-04-27,
1899610,Carlyle AlpInvest Private Markets Fund,2026-03-09,2025-12-01
1900830,Thornburg Strategic Income Opportunities Trust,2023-01-23,
1901164,T. Rowe Price OHA Select Private Credit Fund,2023-09-25,
1901510,BlackRock Science & Technology Trust III,2021-12-30,
1902649,BlackRock Private Credit Fund,2026-04-30,
1902944,CANTOR FITZGERALD SUSTAINABLE INFRASTRUCTURE FUND,2022-06-29,2025-12-09
1903070,Hartford Schroders Private Opportunities Fund,2023-07-20,2025-12-03
1904800,Destiny Alternative Fund (Tax Exempt) LLC,2022-07-01,2025-12-08
1904958,Thornburg Durable Allocation & Income Trust,2023-04-06,
1905088,Ark Venture Fund,2022-08-08,2026-04-09
1905379,Innovation Access Fund,2024-12-26,
1907437,Opportunistic Credit Interval Fund,2022-06-06,2025-12-05
1911066,Nuveen Churchill Private Capital Income Fund,2025-02-04,
1911129,"CrowdStreet Private Equity REIT I, Inc.",2022-02-15,2026-03-06
1911321,Kennedy Lewis Capital Co,2024-06-18,
1911795,PIMCO California Flexible Municipal Income Fund,2022-06-17,2026-03-05
1912938,First Trust Private Assets Fund,2026-01-20,2025-12-05
1912963,First Trust Private Credit Fund,2022-09-02,2025-12-08
1913724,TPG Twin Brook Capital Income Fund,2025-04-30,
1918642,StepStone Private Venture & Growth Fund,2026-02-26,2025-12-02
1918712,ARES STRATEGIC INCOME FUND,2025-10-24,
1918767,"Constitution Capital Access Fund, LLC",2025-06-30,2025-12-05
1918833,Tailwind Endowment Alternatives Fund,2022-05-16,
1920453,Fidelity Private Credit Fund,2025-04-18,
1922194,Nuveen Loan Opportunities Fund,2022-04-11,
1923622,PGIM Private Credit Fund,2025-04-30,
1925779,Flat Rock Enhanced Income Fund,2022-11-28,2026-03-06
1928047,Emerald Strategic Innovation Interval Fund,2022-05-10,
1929777,Pender Real Estate Credit Fund,2023-02-28,2026-03-10
1930087,Golub Capital Private Credit Fund,2026-01-30,
1930147,"Sound Point Meridian Capital, Inc.",2025-08-12,2025-11-26
1930746,Peak Income Plus Fund,2022-12-05,
1935729,"Poolit Private Equity Access Fund, Inc.",2022-07-01,
1935741,"Poolit Venture Capital Access Fund, Inc.",2022-07-01,
1937073,Calamos Aksia Alternative Credit & Income Fund,2023-05-08,2025-12-03
1938365,Axxes Private Markets Fund,2024-04-19,
1939052,Stone Ridge Trust VIII,2023-03-17,2026-04-02
1940499,JPMorgan Private Markets Fund,2026-03-31,2025-12-04
1944664,Nomura Alternative Income Fund,2023-03-24,2025-12-05
1947598,Hatteras Lower Middle Market Buyouts Fund,2022-09-22,
1948370,PIMCO Municipal Credit Income Fund,2022-10-03,
1948673,Nuveen Municipal Opportunities Fund,2022-10-04,
1949178,Kingsbarn Parallel Income Fund,2023-04-05,
1949594,Fidelity Multi-Strategy Credit Fund,2023-05-10,2026-02-20
1951228,PIMCO Flexible Corporate Income Fund,2023-04-17,
1953146,"CPG Vintage Access Fund VI, LLC",2022-11-04,2025-12-05
1953151,"Cadre Horizon Fund, Inc.",2022-11-10,
1953726,MidBridge Private Markets Fund,2024-10-11,
1954360,Crescent Private Credit Income Corp,2026-04-29,
1954541,Modern Markets Flagship Access Fund Inc.,2022-12-09,
1955857,Brookfield Infrastructure Income Fund Inc.,2025-06-05,2026-03-06
1956458,"Morrison Street Income Fund, LLC",2022-12-27,
1957121,Felicitas Private Markets Fund,2023-11-30,2026-03-09
1957892,StepStone Private Infrastructure Fund,2023-07-11,2025-12-02
1959156,Mammoth Institutional Equity Access Fund,2022-12-20,
1959157,Mammoth Institutional Credit Access Fund,2022-12-20,
1959172,Redwood Real Estate Income Fund,2023-06-21,2026-03-09
1959353,"Oxford Park Income Fund, Inc.",2026-04-16,2025-11-26
1961472,PW Multi-Strategy Income Fund,2023-01-17,
1962937,List Income Opportunities Fund,2023-07-26,
1963682,AB CarVal Opportunistic Credit Fund,2023-10-31,
1965985,Polen Credit Opportunities Fund,2023-08-18,2026-01-05
1966776,KKR Asset-Based Income Fund,2023-04-25,2026-03-02
1968178,SEI Alternative Income Fund,2023-10-06,2026-04-27
1968390,Diffractive Real Assets Fund,2023-03-09,
1969180,Coller Secondaries Private Equity Opportunities Fund,2026-03-05,2025-12-04
1969229,Eaton Vance Floating-Rate Opportunities Fund,2023-08-31,2025-07-28
1970466,First Trust Hedged Strategies Fund,2023-06-23,2025-12-05
1974020,MREC2 Fund,2023-06-27,
1975736,KKR FS Income Trust Select,2023-06-07,
1976336,Antares Private Credit Fund,2025-02-05,
1976535,Equi Multi-Strategy Fund,2023-10-18,
1976685,Institutional Investment Strategy Fund,2024-02-23,2025-12-02
1978024,Apollo S3 Private Markets Fund,2024-04-11,2025-12-01
1979881,EMERGING GROWTH & DIVIDEND REINVESTMENT FUND,2023-06-08,
1982067,BlackRock 2038 Municipal Target Term Trust,2023-06-23,
1982467,Jackson Credit Opportunities Fund,2023-11-21,2025-11-25
1982701,AB Private Lending Fund,2024-07-26,
1984165,CAZ Strategic Opportunities Fund,2024-01-09,2025-12-05
1984677,AIR Diversified Alpha Fund,2023-07-14,
1987221,AMG Comvest Senior Lending Fund,2024-11-22,
1987990,KKR US Direct Lending Fund-U,2023-10-13,2026-03-03
1988276,Baseline CRE Income Fund,2025-02-10,
1988752,Meketa Infrastructure Fund,2024-01-24,2025-12-05
1988855,Manulife Private Credit Plus Fund,2024-09-13,2026-03-06
1989393,Partners Group Next Generation Infrastructure LLC,2024-02-14,2025-12-09
1989582,PGIM Credit Income Fund,2023-12-05,2026-03-09
1989979,Principal Private Credit Fund,2023-11-14,
1990685,Niagara Income Opportunities Fund,2023-12-22,2025-12-04
1990804,ABX Longevity Growth & Income Fund,2026-02-27,
1991706,"Partners Group Growth, LLC",2024-02-27,2025-12-09
1992148,Eagle Point Enhanced Income Trust,2024-05-30,2025-11-28
1995568,Voya Enhanced Securitized Income Fund,2024-03-19,2025-11-10
1995668,MainStay MacKay Municipal Income Opportunities Fund,2024-03-19,2026-01-09
1995940,AMG Pantheon Credit Solutions Fund,2024-04-01,2025-12-08
1996211,Connetic Venture Capital Access Fund,2024-09-30,2025-12-08
1997641,Global X Venture & Innovation Fund,2026-04-28,
1997906,CION Grosvenor Infrastructure Fund,2024-11-08,2025-12-05
1998043,Pearl Diver Credit Co Inc.,2025-09-16,2026-03-06
1998759,Nuveen Enhanced Floating Rate Income Fund,2023-11-21,
2000182,Denali Structured Return Strategy Fund,2024-03-07,2025-12-04
2000645,Octagon XAI CLO Income Fund,2024-02-12,2025-12-04
2001323,"CPG Vintage Access Fund VII, LLC",2024-02-02,2025-12-05
2001586,"CION Grosvenor Infrastructure Master Fund, LLC",2025-01-22,2025-12-05
2002660,"Pershing Square USA, Ltd.",2026-04-24,
2002993,Fidelity Floating Rate Opportunities Fund,2024-01-05,
2003497,Jackson Real Assets Fund,2024-04-11,2025-11-25
2003867,Axxes Opportunistic Credit Fund,2024-09-27,2025-12-09
2004413,Beacon Pointe Multi-Alternative Fund,2024-06-27,2025-12-09
2004937,Aether Infrastructure & Natural Resources Fund,2025-03-21,
2005032,HPS Corporate Capital Solutions BDC,2025-01-31,
2005563,Lord Abbett Flexible Income Fund,2025-01-21,2026-03-04
2006100,StepStone Private Credit Income Fund,2024-05-22,2026-03-06
2006189,First Eagle Real Estate Debt Fund,2025-03-26,2026-03-06
2007649,Catalyst Strategic Income Opportunities Fund,2024-07-02,2025-12-08
2008602,Franklin Lexington Private Markets Fund,2025-07-29,2025-12-01
2008638,John Hancock Multi Asset Credit Fund,2024-05-29,2025-12-30
2008939,Accordant Real Estate Growth Fund,2024-03-07,
2009073,Fairway Private Markets Fund,2024-01-31,
2012326,AB CarVal Credit Opportunities Fund,2024-09-11,2026-03-03
2012830,Pop Venture Fund,2025-01-22,
2012980,Gemcorp Commodities Alternative Products Fund,2024-02-27,2026-03-09
2013536,Eagle Point Defensive Income Trust,2025-06-27,2025-11-28
2013732,FT Vest Hedged Equity Income Fund: Series A2,2024-03-11,2026-03-09
2014825,Sphinx Opportunity Fund,2024-08-23,
2015571,TCW Spirit Direct Lending LLC,2024-05-30,2025-09-02
2015849,MA Specialty Credit Income Fund,2024-12-13,2026-03-05
2016900,Principal Private Credit Fund I,2024-05-29,2025-11-25
2017577,Privacore PCAAM Alternative Growth Fund,2026-03-05,2025-12-05
2017579,Privacore PCAAM Alternative Income Fund,2025-08-01,2025-12-05
2018765,First Eagle Municipal High Income Fund,2024-04-19,
2020282,Guggenheim Income Opportunities Fund,2024-04-23,
2020407,HarbourVest Private Investments Fund,2025-12-12,2025-12-05
2020510,Hamilton Lane Private Infrastructure Fund,2024-09-27,2025-12-05
2020928,OneAscent Capital Opportunities Fund,2024-12-18,2025-12-08
2021225,Sardis Credit Opportunities Fund,2025-09-18,2026-03-05
2021966,FT Vest Total Return Income Fund: Series A2,2026-03-10,2026-03-09
2021979,First Trust Enhanced Private Credit Fund,2026-04-22,2025-12-08
2022290,Diamond Hill Securitized Credit Fund,2024-09-25,2026-02-20
2022674,Variant Alternative Lending Fund,2024-09-27,2026-01-09
2023164,Booster Income Opportunities Fund,2024-10-11,2025-11-10
2023773,"iDirect Multi-Strategy Fund, LLC",2025-08-14,2025-12-08
2024814,STARTINVEST VENTURE FUND,2024-06-06,
2025933,FT Vest Hedged Equity Income Fund: Series A3,2024-07-22,2026-03-09
2025934,FT Vest Hedged Equity Income Fund: Series A4,2024-10-17,2026-03-09
2026098,Gladstone Alternative Income Fund,2024-10-17,2025-12-04
2026275,Wellington Global Multi-Strategy Fund,2024-12-16,2026-01-08
2026675,Align Alternative Access Fund,2025-05-08,2025-12-08
2026947,"Macquarie Energy Transition Infrastructure Fund, LLC",2024-06-17,
2027055,Russell Investments New Economy Infrastructure Fund,2025-06-17,
2027076,Prospect Enhanced Yield Fund,2025-07-31,2026-03-09
2027232,Hamilton Lane Credit Income Fund,2026-03-20,
2027343,Sphinx Opportunity Fund II,2025-08-06,
2028174,Sound Point Alternative Income Fund,2026-03-12,
2028436,T. Rowe Price OHA Flexible Credit Income Fund,2026-03-02,2026-02-26
2029010,North Haven Private Assets Fund,2025-02-19,2025-12-02
2029168,Callodine Specialty Income Fund,2025-08-13,2026-03-09
2029852,Lord Abbett Municipal Opportunities Fund,2024-10-07,2025-12-04
2031142,Russell Investments Strategic Credit Fund,2026-04-21,
2031545,FT Vest Total Return Income Fund: Series A4,2024-10-17,2026-03-09
2031546,FT Vest Total Return Income Fund: Series A3,2024-07-26,2026-03-09
2032432,Blackstone Private Multi-Asset Credit & Income Fund,2025-03-05,2026-03-04
2033088,ISQ OpenInfra Income Fund,2025-04-17,
2033164,Rockefeller Municipal Opportunities Fund,2024-11-26,2025-12-05
2033620,Coller Private Credit Secondaries,2025-06-27,2025-12-04
2035632,John Hancock CQS Asset Backed Securities Fund,2024-12-30,2025-12-30
2035726,Nuveen Enhanced CLO Income Fund,2025-01-06,2025-11-06
2036029,83 Investment Group Income Fund,2026-02-27,2025-12-09
2036272,TCW Private Asset Income Fund,2025-03-04,2026-03-09
2036648,FT Vest Rising Dividend Achievers Total Return Fund,2024-09-20,2026-03-09
2038912,Cantor Fitzgerald Energy Fund,2025-08-29,
2039471,Ardian Access LLC,2025-04-24,2025-12-08
2040278,HL Scope RIC LLC,2024-10-11,2026-03-09
2040315,Capital Group KKR Core Plus (plus),2025-04-16,2026-03-09
2040318,Capital Group KKR Multi-Sector (plus),2025-04-16,2026-03-09
2041175,NB Asset-Based Credit Fund,2025-08-19,2026-03-06
2041398,Hamilton Lane Private Secondary Fund,2025-02-25,2025-12-05
2041672,JETSTREAM VENTURE FUND,2025-09-02,2025-12-05
2041900,Columbia Credit Income Opportunities Fund,2025-04-10,2026-04-06
2042256,"iDirect Private Credit Fund, L.P.",2025-06-26,2025-12-08
2043597,Private Debt & Income Fund,2026-02-19,2025-12-09
2044327,C1 Fund Inc.,2025-07-28,
2044490,SEG Partners Long/Short Equity Fund,2025-04-08,2026-01-06
2044519,Coatue Innovative Strategies Fund,2026-04-30,2026-03-06
2045371,Corient Registered Alternatives Fund,2024-11-19,2025-12-05
2046200,"AMG Pantheon Infrastructure Fund, LLC",2025-06-04,2025-12-08
2047442,Calamos Aksia Private Equity & Alternatives Fund,2025-06-25,2026-03-04
2047636,RJ Private Credit Income Fund,2025-10-14,
2047692,Hamilton Lane Venture Capital & Growth Fund,2025-04-30,2025-12-05
2049810,Virtus Global Credit Opportunities Fund,2025-08-22,
2050541,First Eagle Tactical Municipal Opportunities Fund,2025-05-29,2026-03-06
2051024,Champion Fund,2026-03-19,
2051511,Oaktree Asset-Backed Income Fund Inc.,2025-07-31,2026-03-06
2051512,Oaktree Asset-Backed Income Private Fund Inc.,2025-02-03,2025-09-04
2051661,Optimize Premium Yield Fund,2025-02-21,
2051663,Optimize Growth Equity Fund,2025-02-21,
2052053,Powerlaw Corp.,2026-03-25,2025-12-19
2052250,GoldenTree Opportunistic Credit Fund,2025-06-10,2026-03-06
2052411,FT Vest Total Return Income Fund: Series B1,2025-02-13,2026-03-09
2052961,FT Vest Hedged Equity Income Fund: Series B1,2025-02-13,2026-03-09
2053084,"Fundrise Real Estate Interval Fund II, LLC",2025-10-09,
2053339,Savvly Fund #3,2026-04-27,
2054992,Lincoln Bain Capital Total Credit Fund,2025-09-02,2025-11-25
2054995,Lincoln Partners Group Royalty Fund,2025-09-23,2025-11-26
2055004,Pursuit Asset-Based Income Fund,2025-09-22,
2055855,Megacorn Fund,2026-04-29,
2056164,JPMorgan Credit Markets Fund,2026-01-28,
2056760,Regan Capital Alternative Income Fund,2026-04-23,
2058263,Carlyle AlpInvest Private Markets Secondaries Fund,2025-09-17,
2059105,StepStone Private Credit Co-Investment Fund,2025-04-25,2026-03-03
2059436,Blue Owl Alternative Credit Fund,2025-08-07,2026-02-27
2060729,FT Vest Annual Hedged Equity & Income Fund: Series B1,2025-03-17,
2060934,TPG Private Markets Fund,2025-07-16,
2061233,Morgan Stanley Private Markets & Alternatives Fund,2026-04-29,2025-12-08
2061357,Guggenheim Investments Private Credit Fund,2026-03-18,
2061670,Monroe Capital Enhanced Corporate Lending Fund,2025-12-02,
2063352,"CAIS Sports, Media & Entertainment Fund",2025-08-14,
2063706,Calamos Aksia Hedged Strategies Fund,2025-09-16,
2063946,Franklin BSP Lending Fund,2025-09-29,2026-03-04
2065443,AAM Alternatives Trust,2025-10-31,
2065812,New FS Specialty Lending Fund,2025-07-25,2026-03-02
2065909,WVB All Markets Fund,2026-04-16,
2066313,599 Fund LLC,2026-02-23,
2066346,Tap US Private Equity Fund of Funds,2026-04-21,
2066579,Privacore VPC Asset Backed Credit Fund,2025-08-29,2025-12-09
2066799,StepStone Private Equity Strategies Fund,2025-07-31,2025-12-02
2066984,FT Vest Total Return Income Fund: Series B2,2025-05-08,2026-03-09
2066993,Origin Real Estate Credit Fund,2025-12-30,
2067009,FT Vest Hedged Equity Income Fund: Series B2,2025-05-08,2026-03-09
2067434,Banner Ridge DSCO Private Markets Fund,2026-02-18,
2067955,Diameter Dynamic Credit Fund,2026-03-19,
2069244,FT Vest Total Return Income Fund: Series B4,2025-10-08,
2069247,FT Vest Hedged Equity Income Fund: Series B3,2025-07-11,2026-03-09
2069248,FT Vest Total Return Income Fund: Series B3,2025-07-11,2026-03-09
2070029,Man Alternative Income Fund,2026-03-04,
2070546,TCG Strategic Income Fund,2025-12-11,
2071525,Pre-IPO & Growth Fund,2026-01-12,
2074612,LibreMax Asset-Backed Income Fund,2026-04-15,
2076022,EP Private Capital Fund I,2025-07-25,2025-11-28
2076294,IDA Private Access Fund,2025-12-08,
2077345,Ultra AI Opportunities Inc.,2026-03-02,
2077354,Ultra Aerospace Opportunities Inc.,2026-03-06,
2077697,"RiverNorth Short Prime Unicorn Fund 2028, Inc",2026-02-25,
2077715,"RiverNorth Long Prime Unicorn Fund 2028, Inc.",2026-02-25,
2078146,PennantPark Enhanced Income Fund,2025-12-09,
2078301,Capital Group KKR U.S. Equity (plus),2026-02-19,
2079872,CAZ GP Stakes Fund,2026-01-16,
2080574,Gabelli Preferred & Income Trust,2025-08-15,
2081119,"RoboStrategy, Inc.",2026-04-30,
2083703,Sixth Street Dynamic Alternatives Fund,2025-12-19,
2085091,Robinhood Ventures Fund I,2026-04-13,
2086532,Alger Next Gen Growth Fund,2026-04-23,
2087385,ProShares Private Equity Access Fund,2025-09-29,
2087834,CIBC Private Lending Strategies,2026-02-13,
2090145,"CAIS Sports, Media & Entertainment Fund",2025-10-08,
2092012,RBC BlueBay Enhanced Income Fund,2026-04-28,
2092050,Adams Street Venture & Growth Fund,2026-04-03,
2092387,Aristotle Pacific Enhanced CLO Income Fund,2026-03-13,
2093364,Ardian Access Secondary Infrastructure Fund LLC,2026-05-01,
2093738,Destiny Alternative Fund,2025-10-29,
2094188,Franklin Infrastructure Solutions Fund,2026-02-12,
2094939,WVB Blackstone All Privates Fund,2026-04-15,
2094982,Manulife GA Trust,2026-02-12,
2095816,VanEck CLO Opportunities Fund,2026-03-16,
2097023,OHA DIRECT CREDIT FUND,2025-12-23,
2097545,"AMG BBH Asset-Backed Credit Fund, LLC",2025-12-05,
2097666,T. Rowe Price Goldman Sachs Private Markets Fund,2026-02-13,
2097714,Axxes Real Estate Fund,2025-11-21,
2098011,Parvin Decentralized Fund,2026-04-01,
2100319,Dawson Private Markets Evergreen Fund,2026-04-09,
2101407,Tortoise Energy & Infrastructure Interval Fund,2025-12-30,
2102111,"Constitution Capital Evergreen Partnership Fund, LLC",2026-01-09,
2102580,GCM Grosvenor Private Equity Capital Opportunities Fund,2026-04-01,
2103422,FT Vest Total Return Income Fund: Series A1,2026-02-05,
2103519,Nilsine Partners NP1X Fund,2026-01-07,
2104046,Buttonwood First Access Fund Ltd.,2026-04-28,
2107262,Muzinich Aviation Income Fund (mAIR),2026-04-07,
2114459,Cascade Real Assets Fund,2026-02-27,
2115366,Amplifi Collective Fund,2026-03-23,
2115681,Morgan Stanley Private Markets & Alternatives Fund - Growth,2026-03-05,
2115684,Morgan Stanley Private Markets & Alternatives Fund - Income,2026-03-05,
2116045,G-X Private Equity,2026-04-03,
2117535,Franklin Lexington Venture & Growth Fund,2026-03-20,
2119699,AAM/Wilshire Infrastructure Fund,2026-03-13,
2120416,Alpha Summit Strategic Alternatives Fund,2026-03-27,
2120563,JPMorgan Tax Aware Opportunities Fund,2026-04-29,
2120567,JPMorgan Public & Private Credit Fund,2026-03-25,
2121502,Felicitas Income Fund,2026-03-24,
2123596,AQR Delphi Long-Short Fund,2026-03-27,
2124252,Concurrent Income & Innovation Fund,2026-03-27,
2124948,North Haven Strategic Credit Fund,2026-04-03,
2125874,HB Wealth Credit Opportunities Fund,2026-04-13,
2126563,Brookmont Consumer Credit Fund,2026-04-06,
2128311,CAZ GP Stakes Growth Fund,2026-04-14,
2128647,Third Lake Partners Alternative Yield Strategy Fund,2026-04-10,
