crd,firm_name,aum_billions,stratum,parsed_total,parsed_entities,entity_names,in_matched,audit_status,audit_entities_correct,audit_entities_missed,audit_codes_correct,audit_notes,audit_pymupdf_entities,audit_plumber_entities,audit_common,audit_code_match,audit_pymupdf_only,audit_plumber_only,audit_size_mb
109355,"MDT ADVISERS, A DIVISION OF FEDERATED MDTA LLC",11.66,matched_large,11,5,"FEDERATED MDTA TRUST(E); HBSS ACQUISITION CO.(C); FII HOLDINGS, INC.(E); FEDERATED HERMES, INC.(E); FEDERATED MDTA TRUST(E)",True,MATCH,,,,,4,4,4,4,,,1.7
105377,"LOOMIS, SAYLES & COMPANY, L.P.",350.89,matched_large,15,2,"LOOMIS, SAYLES & COMPANY, INCORPORATED(NA); NATIXIS INVESTMENT MANAGERS, LLC(E)",True,PLUMBER_EXTRA,,,,,6,2,0,0,"BPCE; MANAGERS, LLC; INCORPORATED","LOOMIS, SAYLES & COMPANY, INCORPORATED; NATIXIS INVESTMENT MANAGERS, LLC",3.2
301973,PTMA INVESTMENT ADVISORS,27.79,matched_large,32,17,"PUBLIC TRUST ADVISORS, LLC(E); PMA PARENT HOLDINGS, LLC(E); TA PMA INTERMEDIATE, LLC(E); TA PMA PURCHASER, LLC(E); PMA-PTA HOLDINGS, LLC(E)",True,MATCH,,,,,17,17,17,17,,,1.2
160925,"GRAHAM CAPITAL MANAGEMENT, L.P.",28.54,matched_large,17,7,"KGT INVESTMENT PARTNERS, L.P.(E); KGT GP LLC(NA); KGT CAPITAL LIMITED PARTNERSHIP(E); KGT, INC.(E); KENNETH G. TROPIN REVOCABLE TRUST(E)",True,CODE_MISMATCH,,,,,8,7,7,6,"GRAHAM CAPITAL MANAGEMENT, L.P.",,5.0
144594,"O'SHAUGHNESSY ASSET MANAGEMENT, LLC",19.78,matched_large,14,1,"FRANKLIN RESOURCES, INC.(E)",True,MATCH,,,,,1,1,1,1,,,1.1
138653,J O HAMBRO CAPITAL MANAGEMENT LIMITED,23.28,matched_large,12,3,PENDAL GROUP LIMITED(E); PERPETUAL ACQUISITION COMPANY LIMITED(E); PERPETUAL LIMITED(E),True,PLUMBER_EXTRA,,,,,3,3,2,2,COMPANY LIMITED,PERPETUAL ACQUISITION COMPANY LIMITED,1.8
107338,"SUNAMERICA ASSET MANAGEMENT, LLC",57.42,matched_large,29,19,"APH HOLDINGS, L.P.(E); APO CORP.(E); APOLLO ASSET MANAGEMENT, INC(E); APOLLO HYBRID VALUE CREDIT HOLDINGS, L.P(D); APOLLO HYBRID VALUE FUND, L.P(D)",True,PLUMBER_EXTRA,,,,,19,19,16,16,"(BERMUDA) LTD; VENERABLE HOLDINGS, INC.; GMBH & CO KG",ATHORA LEBENSVERSICHERUNG AG; ATHORA DEUTSCHLAND HOLDING GMBH & CO KG; ATHORA EUROPE HOLDING (BERMUDA) LTD,1.1
111883,"AQR CAPITAL MANAGEMENT, LLC",160.52,matched_large,14,4,"HOLDINGS, LLC(E); AQR CAPITAL MANAGEMENT GROUP, L.P.(D); AFFILIATED MANAGERS GROUP, INC.(E); TOPSPIN ACQUISITION, LLC(C)",True,PYMUPDF_ONLY,,,,,4,0,0,0,"AQR CAPITAL MANAGEMENT GROUP, L.P.; TOPSPIN ACQUISITION, LLC; AFFILIATED MANAGERS GROUP, INC.",,36.0
106975,"VAUGHAN NELSON INVESTMENT MANAGEMENT, L.P.",15.87,matched_large,14,7,"NATIXIS INVESTMENT MANAGERS, LLC(E); VAUGHAN NELSON INVESTMENT MANAGEMENT, IN(NA); NATIXIS INVESTMENT MANAGERS(E); NATIXIS INVESTMENT MANAGERS, LLC(E); NATIXIS INVESTMENT MANAGERS PARTICIPATIO(E)",True,PLUMBER_EXTRA,,,,,6,6,4,4,"MANAGEMENT, INC.; PARTICIPATIONS 1","NATIXIS INVESTMENT MANAGERS PARTICIPATIONS 1; VAUGHAN NELSON INVESTMENT MANAGEMENT, INC.",1.9
157920,"CLEARLAKE CAPITAL GROUP, L.P.",79.58,matched_large,132,45,"CLEARLAKE CAPITAL GROUP GP,(NA); CCG OPERATIONS, LLC(E); CCG GLOBAL, LLC(E); HOLDINGS, L.P.(E); CCG OPERATIONS, LLC(D)",True,PYMUPDF_ONLY,,,,,14,0,0,0,"CCG MEMBERCO LIMITED; CLEARLAKE CAPITAL PARENT HOLDINGS, L.P.; CLEARLAKE CAPITAL GROUP, L.P.",,26.0
156610,VERITION FUND MANAGEMENT LLC,130.51,matched_large,36,15,"VERITION FUND MANAGEMENT LLC(E); VERITION FUND MANAGEMENT NY, INC.(E); VERITION FUND MANAGEMENT LLC(E); VERITION FUND MANAGEMENT NY, INC.(E); VERITION ADVISORS (UK) II LTD(D)",True,MATCH,,,,,8,5,5,5,"VERITION CANADA CORP; TOPSPIN ACQUISITION, LLC; AFFILIATED MANAGERS GROUP, INC.",,3.9
104853,BOSTON MANAGEMENT AND RESEARCH,128.14,matched_large,2,0,,True,PLUMBER_EXTRA,,,,,3,2,1,1,"MANAGEMENT, LLC; EATON VANCE MANAGEMENT","MORGAN STANLEY CAPITAL MANAGEMENT, LLC",6.8
105811,"CIGNA INVESTMENTS, INC.",27.52,matched_large,7,3,"CIGNA INVESTMENT GROUP, INC.(E); CIGNA HOLDINGS, INC.(E); CIGNA CORPORATION(E)",True,MATCH,,,,,3,3,3,3,,,1.5
106940,WINSLOW CAPITAL MANAGEMENT LLC,27.17,matched_large,12,8,"NUVEEN WCM HOLDINGS, LLC(E); NUVEEN HOLDINGS, INC.(E); NUVEEN INVESTMENTS, INC.(E); TIAA BOARD OF GOVERNORS(E); TEACHERS INSURANCE AND ANNUITY ASSOCIATI(E)",True,PLUMBER_EXTRA,,,,,8,8,6,6,"No. NUVEEN HOLDINGS, INC.; ANNUITY ASSOCIATION OF AMERICA","NUVEEN HOLDINGS, INC.; TEACHERS INSURANCE AND ANNUITY ASSOCIATION OF AMERICA",3.1
124509,ABRDN ASIA LIMITED,43.38,matched_large,8,2,ABRDN HOLDINGS LIMITED(E); ABERDEEN GROUP PLC(E),True,PLUMBER_EXTRA,,,,,2,2,1,1,No. ABRDN HOLDINGS LIMITED,ABRDN HOLDINGS LIMITED,2.3
306308,MIDWEST HERITAGE FINANCIAL ADVISORS,0.4,matched_small,4,2,"MIDWEST HERITAGE BANK, FSB(E); HY-VEE FOOD STORES, INC.(E)",True,MATCH,,,,,2,2,2,2,,,1.0
111452,"RATIONAL ADVISORS, INC.",2.28,matched_small,1,0,,True,PYMUPDF_ONLY,,,,,1,0,0,0,JERRY J. SZILAGYI 2015 FAMILY TRUST,,1.7
226721,"ELEVATED CAPITAL ADVISORS, LLC",0.43,matched_small,5,2,"SPL FINANCIAL, LLC(D); GLOBAL PLAINS ADVISORY GROUP, LLC(D)",True,MATCH,,,,,2,2,2,2,,,0.9
106146,SYSTEMATIC FINANCIAL MANAGEMENT LP,3.9,matched_small,4,2,"TITAN NJ LP HOLDINGS LLC(E); AFFILIATED MANAGERS GROUP, INC.(E)",True,CODE_MISMATCH,,,,,2,2,2,1,,,1.1
152569,COASTAL BRIDGE ADVISORS,4.6,matched_small,13,11,"FOCUS OPERATING, LLC(E); FOCUS FINANCIAL PARTNERS, LLC(E); FOCUS FINANCIAL PARTNERS INC.(E); FERDINAND FFP ACQUISITION, LLC(E); FERDINAND FFP ULTIMATE HOLDINGS, LP(E)",True,MATCH,,,,,10,10,10,10,,,1.2
285013,"AIGH CAPITAL MANAGEMENT, LLC",0.33,matched_small,4,1,AIGH INVESTMENT PARTNERS LLC(E),True,MATCH,,,,,1,1,1,1,,,1.2
110933,"ACR ALPINE CAPITAL RESEARCH, LLC",8.51,matched_small,12,4,"ACR ALPINE CAPITAL RESEARCH, LP(E); ALPINE INVESTMENT MANAGEMENT, LLC(E); ALPINE HOLDINGS CORP(E); NICHOLAS V TOMPRAS LIVING TRUST 9/23/23 (E)",True,MATCH,,,,,4,4,4,4,,,1.7
305418,MARINER INDEPENDENT,5.62,matched_small,38,13,"MARINER ADVISOR NETWORK, LLC(E); GEI VIII MW AGGREGATOR LLC(C); GEI VIII MW BLOCKER LLC(D); GREEN EQUITY INVESTORS VIII L.P.(C); GREEN EQUITY INVESTORS SIDE VIII L.P.(E)",True,MATCH,,,,,11,11,11,11,,,2.3
337895,"AVANTYR CAPITAL PARTNERS, LP",2.98,matched_small,5,1,"AVANTYR CAPITAL PARTNERS GP, LLC(NA)",True,MATCH,,,,,1,1,1,1,,,1.2
142150,COHEN & STEERS UK LIMITED,3.97,matched_small,5,1,"COHEN & STEERS, INC.(E)",True,MATCH,,,,,1,1,1,1,,,1.4
172555,"TSFG, LLC",1.0,matched_small,6,1,"TSFG, LLC(E)",True,MATCH,,,,,1,1,1,1,,,1.1
299240,NO STREET GP LP,2.21,matched_small,3,1,NO STREET GP LLC(NA),True,MATCH,,,,,1,1,1,1,,,2.0
297521,DISTILLATE CAPITAL PARTNERS LLC,2.11,matched_small,4,0,,True,BOTH_EMPTY,,,,,0,0,0,0,,,0.9
160715,"SIGNATURE INVESTMENT ADVISORS, LLC",5.73,matched_small,9,3,"SEIA HOLDINGS, LLC(E); REVERENCE CAPITAL PARTNERS(D); SEIA MANAGEMENT, LLC(C)",True,MATCH,,,,,3,3,3,3,,,1.2
108831,SAWGRASS ASSET MANAGEMENT LLC,2.26,matched_small,7,1,"SAWGRASS ASSET MANAGEMENT, INC.(E)",True,PLUMBER_EXTRA,,,,,0,1,0,0,,"SAWGRASS ASSET MANAGEMENT, INC.",1.2
104681,CORTLAND ASSOCIATES INC,1.0,unmatched_large,2,0,,False,BOTH_EMPTY,,,,,0,0,0,0,,,1.1
155733,"FLAGSHIP HARBOR ADVISORS, LLC",3.42,unmatched_large,2,0,,False,BOTH_EMPTY,,,,,0,0,0,0,,,1.5
43285,"M HOLDINGS SECURITIES, INC.",4.08,unmatched_large,5,1,M FINANCIAL HOLDINGS INCORPORATED(E),False,MATCH,,,,,1,1,1,1,,,2.5
127447,"SUSTAINABLE GROWTH ADVISERS, LP",22.14,unmatched_large,7,2,"SGIA, LLC(NA); VIRTUS PARTNERS, INC.(E)",False,PLUMBER_EXTRA,,,,,3,2,1,1,"ID No. SGIA, LLC; VIRTUS INVESTMENT PARTNERS, INC.","SGIA, LLC",2.0
173961,"WILLIAM BLAIR INVESTMENT MANAGEMENT, LLC",71.59,unmatched_large,13,1,"WBC HOLDINGS, L.P.(E)",False,MATCH,,,,,1,1,1,1,,,3.3
150570,AGW CAPITAL ADVISORS,1.48,unmatched_large,4,0,,False,BOTH_EMPTY,,,,,0,0,0,0,,,1.2
110080,HODGES CAPITAL MANAGEMENT INC,1.24,unmatched_large,4,1,HODGES CAPITAL HOLDINGS VOTING TRUST(D),False,MATCH,,,,,2,1,1,1,HODGES CAPITAL HOLDINGS INC.,,1.1
121560,"DEROY & DEVEREAUX PRIVATE INVESTMENT COUNSEL, INC.",2.25,unmatched_large,5,0,,False,BOTH_EMPTY,,,,,0,0,0,0,,,1.1
108199,WOODARD & CO ASSET MANAGEMENT GROUP INC,1.04,unmatched_large,3,0,,False,BOTH_EMPTY,,,,,0,0,0,0,,,0.9
107177,"MERITAGE PORTFOLIO MANAGEMENT, INC.",2.42,unmatched_large,7,0,,False,BOTH_EMPTY,,,,,0,0,0,0,,,1.1
160830,"GREENBRIER PARTNERS CAPITAL MANAGEMENT, LLC",1.39,unmatched_large,1,0,,False,PYMUPDF_ONLY,,,,,1,0,0,0,ROWE MANAGEMENT TRUST,,1.2
107911,CRAMER ROSENTHAL MCGLYNN LLC,2.35,unmatched_large,8,1,CRM 2019 LLC(E),False,MATCH,,,,,1,1,1,1,,,1.3
146025,SILVANT CAPITAL MANAGEMENT LLC,2.45,unmatched_large,7,1,"VIRTUS PARTNERS, INC.(E)",False,MATCH,,,,,2,1,1,1,"VIRTUS INVESTMENT PARTNERS, INC.",,2.0
131692,"VERSANT CAPITAL MANAGEMENT, INC.",1.24,unmatched_large,10,2,ELIZABETH M. SHABAKER REVOCABLE TRUST U/(C); REMINGTON REVOCABLE TRUST U/A DTD 3/28/2(C),False,PLUMBER_EXTRA,,,,,2,2,1,1,DTD 3/28/2014,REMINGTON REVOCABLE TRUST U/A DTD 3/28/2014,1.0
159868,"VIVO CAPITAL, LLC",5.32,unmatched_large,12,0,,False,BOTH_EMPTY,,,,,0,0,0,0,,,5.2
327611,"TIDEMARK, LLC",0.34,unmatched_small,2,0,,False,PYMUPDF_ONLY,,,,,2,0,0,0,"STIP, INC; TAB ADVISORY",,0.9
106688,"R.H. DINEL INVESTMENT COUNSEL,INC.",0.17,unmatched_small,3,0,,False,PLUMBER_EXTRA,,,,,1,1,0,0,"OFFICER, TRUSTEE OF THE DINEL FAMILY TRUST THE DINEL FAMILY TRUST",THE DINEL FAMILY TRUST,0.9
168566,"MY WEALTH MANAGEMENT, INC",0.16,unmatched_small,2,0,,False,BOTH_EMPTY,,,,,0,0,0,0,,,0.9
109423,"SHAYNE & JACOBS, LLC",0.56,unmatched_small,2,0,,False,BOTH_EMPTY,,,,,0,0,0,0,,,0.9
162083,"PL CAPITAL ADVISORS, LLC",0.31,unmatched_small,4,0,,False,BOTH_EMPTY,,,,,0,0,0,0,,,2.8
135470,PHOCAS FINANCIAL CORPORATION,0.79,unmatched_small,5,0,,False,BOTH_EMPTY,,,,,0,0,0,0,,,0.8
281160,"CLARUS WEALTH ADVISORS, LLC",0.26,unmatched_small,6,2,"CLEAR VIEW FINANCIAL, LLC(E); COOPER 2378 TRUST DATED MAY 8, 2020(E)",False,PLUMBER_EXTRA,,,,,2,2,1,1,"ID No. COOPER 2378 TRUST DATED MAY 8, 2020","COOPER 2378 TRUST DATED MAY 8, 2020",1.0
108542,"SKBA CAPITAL MANAGEMENT, LLC",0.66,unmatched_small,7,1,THE BISCHEL FAMILY REVOCABLE TRUST(B),False,MATCH,,,,,1,1,1,1,,,1.0
170041,"FLUENT FINANCIAL, LLC",0.3,unmatched_small,2,0,,False,BOTH_EMPTY,,,,,0,0,0,0,,,0.9
119135,SHAKER INVESTMENTS,0.25,unmatched_small,6,0,,False,BOTH_EMPTY,,,,,0,0,0,0,,,1.2
328007,BALANCED WEALTH GROUP LLC,0.42,unmatched_small,3,0,,False,BOTH_EMPTY,,,,,0,0,0,0,,,0.9
318747,RANSOM ADVISORY,0.32,unmatched_small,1,0,,False,BOTH_EMPTY,,,,,0,0,0,0,,,0.9
168073,MATUNE BASILE ADVISORS,0.34,unmatched_small,3,0,,False,BOTH_EMPTY,,,,,0,0,0,0,,,0.9
288215,MAYPORT WEALTH MANAGEMENT,0.48,unmatched_small,1,0,,False,BOTH_EMPTY,,,,,0,0,0,0,,,0.9
281049,"WALLACE ADVISORY GROUP, LLC",0.27,unmatched_small,1,0,,False,BOTH_EMPTY,,,,,0,0,0,0,,,0.9
161987,BLACKROCK ASSET MANAGEMENT SCHWEIZ AG,1.62,oversized,34,25,"BLACKROCK FINANCE, INC.(E); BLACKROCK HOLDCO 2, INC(E); BLACKROCK FINANCIAL MANAGEMENT, INC(E); BR JERSEY INTERNATIONAL HOLDINGS L.P.(E); BLACKROCK GROUP LIMITED(E)",True,PYMUPDF_ONLY,,,,,13,0,0,0,"BLACKROCK FINANCIAL MANAGEMENT, INC; BLACKROCK HOLDCO 2, INC; BLACKROCK FINANCE, INC.",,13.2
6210,WILSHIRE,99.1,oversized,45,19,"MONICA HOLDCO (US) INC.(E); MONICA GUARANTOR, LP(E); MONICA INTERMEDIATE, LP(E); MONICA HOLDINGS (JERSEY), LP(E); MONICA HOLDINGS (JERSEY), LP(E)",True,PYMUPDF_ONLY,,,,,15,0,0,0,"MONICA HOLDCO (US) INC.; CC MONICA HOLDINGS, LLC; CC-SGG MONICA AGGREGATOR, LLC",,23.2
158508,"BATTERY GLOBAL ADVISORS, LLC",6.9,oversized,11,0,,False,PYMUPDF_ONLY,,,,,0,0,0,0,,,15.3
160272,FRANCISCO PARTNERS,45.08,oversized,16,3,"FRANCISCO PARTNERS MANAGEMENT GP, LLC(NA); FRANCISCO PARTNERS HOLDINGS, L.P.(E); FRANCISCO PARTNERS FEEDER, L.P.(E)",True,PYMUPDF_ONLY,,,,,3,0,0,0,"FRANCISCO PARTNERS HOLDINGS, L.P.; FRANCISCO PARTNERS MANAGEMENT GP, LLC; FRANCISCO PARTNERS FEEDER, L.P.",,10.1
160318,"TIGER GLOBAL MANAGEMENT, LLC",69.56,oversized,27,7,"TIGER GLOBAL MANAGEMENT, LLC(E); TIGER GLOBAL MANAGEMENT, LLC(E); TIGER GLOBAL MANAGEMENT, LLC(E); TIGER GLOBAL MANAGEMENT, LLC(E); TIGER GLOBAL MANAGEMENT, LLC(E)",True,PYMUPDF_ONLY,,,,,1,0,0,0,"TIGER GLOBAL MANAGEMENT, LLC",,11.1
108679,"D. E. SHAW & CO., L.P.",154.59,oversized,48,18,"D. E. SHAW & CO., INC.(NA); PLAINTEXT HOLDINGS, LLC(B); BIG HEN GROUP I, LLC(E); D. E. SHAW & CO., L.P.(E); D. E. SHAW & CO., L.P.(E)",True,PYMUPDF_ONLY,,,,,6,0,0,0,"D. E. SHAW & CO., L.P.; THE SCHMIDT FAMILY LIVING TRUST; D. E. SHAW & CO. (U.K.),",,12.4
157349,MADISON DEARBORN PARTNERS,16.08,oversized,19,0,,False,PYMUPDF_ONLY,,,,,0,0,0,0,,,13.4
107876,HAMILTON LANE,138.3,oversized,16,5,"HAMILTON LANE ADVISORS INC(NA); HLA INVESTMENTS, LLC(B); HL MANAGEMENT INVESTORS LLC(A); HAMILTON LANE INC(E); HRHLA, LLC(E)",False,PYMUPDF_ONLY,,,,,5,0,0,0,"HLA INVESTMENTS, LLC; HL MANAGEMENT INVESTORS LLC; HAMILTON LANE INC",,104.3
122711,"CRESTLINE MANAGEMENT, L.P.",20.49,oversized,25,19,RITHM ASSET MANAGEMENT LLC(E); NRZ MBN ISSUER HOLDINGS LLC(E); RITHM CAPITAL MANAGEMENT LLC(E); RITHM CAPITAL CORP.(E); CRESTLINE CANADA GP LLC(NA),True,PYMUPDF_ONLY,,,,,8,0,0,0,RITHM CRESTLINE HOLDINGS LLC; RITHM ASSET MANAGEMENT LLC; CRESTLINE CANADA GP LLC,,14.8
148826,CITADEL ADVISORS LLC,445.96,oversized,54,14,CITADEL ADVISORS HOLDINGS LP(E); CITADEL LIMITED PARTNERSHIP(E); GFH HFEVA LLC(D); CITADEL HEDGE FUND HOLDINGS LP(E); CITADEL HEDGE FUND HOLDINGS LP(E),False,PYMUPDF_ONLY,,,,,5,0,0,0,CITADEL ADVISORS HOLDINGS LP; CITADEL AMERICAS LLC; CITADEL HEDGE FUND HOLDINGS LP,,10.9
152538,"BTG PACTUAL ASSET MANAGEMENT US , LLC",25.63,oversized,26,12,BTG PACTUAL BANCORP LLC(E); BANCO BTG PACTUAL S.A.(E); BTG PACTUAL HOLDING S.A.(E); BTG PACTUAL G7 HOLDING S.A.(C); BTG PACTUAL HOLDING FINANCEIRA LTDA.(D),True,PYMUPDF_ONLY,,,,,6,0,0,0,BTG PACTUAL G7 HOLDING S.A.; BTG PACTUAL HOLDING FINANCEIRA LTDA; BTG PACTUAL HOLDING FINANCEIRA LTDA.,,11.3
148949,"VARDE MANAGEMENT, L.P.",17.98,oversized,114,17,"VÄRDE MANAGEMENT, INC.(NA); VÄRDE HUS, L.P.(NA); VPE BL, LLC(E); VARDE MANAGEMENT, L.P.(E); VARDE MANAGEMENT, L.P.(E)",True,PYMUPDF_ONLY,,,,,4,0,0,0,"VÄRDE MANAGEMENT, INC.; VÄRDE HUS, L.P.; VPE BL, LLC",,12.7
107913,SCULPTOR CAPITAL LP,44.26,oversized,49,23,"CORPORATION(NA); CALDER HOLDCO I LP(E); MANAGEMENT, INC.(E); RITHM CAPITAL CORP.(E); SCULPTOR CAPITAL LP(E)",True,PYMUPDF_ONLY,,,,,10,0,0,0,CALDER HOLDCO I LP; HOLDING CORPORATION; SCULPTOR LOAN MANAGEMENT LLC,,26.9
37550,RUSSELL INVESTMENTS,27.22,oversized,15,8,"RUSSELL INVESTMENTS US INSTITUTIONAL HOL(E); EMERALD ACQUISITION LIMITED(E); RUSSELL INVESTMENTS GROUP, LTD.(E); TA XII-A EU AIV, L.P.(C); RUSSELL INVESTMENTS CAYMAN MIDCO, LTD(E)",True,PYMUPDF_ONLY,,,,,5,0,0,0,"INSTITUTIONAL HOLDCO, INC.; RUSSELL INVESTMENTS GROUP, LTD.; RUSSELL INVESTMENTS CAYMAN MIDCO, LTD",,10.6
156945,WARBURG PINCUS LLC,97.24,oversized,35,13,"VENTURES, LLC(E); WARBURG PINCUS ASIA LTD(E); WARBURG PINCUS LLC(E); WARBURG PINCUS LLC(E); WARBURG PINCUS LLC(E)",True,PYMUPDF_ONLY,,,,,6,0,0,0,"WARBURG PINCUS LLC; WARBURG PINCUS ASIA LTD; WPPS MANAGER GP, LLC",,50.7
130074,ARES MANAGEMENT LLC,359.15,timed_out,318,160,"ARES MANAGEMENT HOLDINGS L.P.(E); ARES OWNERS HOLDINGS, L.P.(C); ARES HOLDINGS, L.P.(E); ARES HOLDCO LLC(D); ARES MANAGEMENT CORPORATION(E)",True,PYMUPDF_ONLY,,,,,51,0,0,0,"LANDMARK PARTNERS LLC; FUND IV GP, LLC; ARES REAL ESTATE INVESTMENT HOLDINGS",,156.2
162589,ICG INVESTMENTS INC,37.74,timed_out,21,6,ICG FMC LIMITED(E); ICG INVESTMENTS INC(E); ICG FMC LIMITED(E); ICG PLC(E); ICG INVESTMENTS INC(E),True,PYMUPDF_ONLY,,,,,3,0,0,0,ICG INVESTMENTS INC; ICG PLC; ICG FMC LIMITED,,16.8
151599,"BROOKFIELD ASSET MANAGEMENT PIC US, LLC",92.29,timed_out,100,62,BROOKFIELD US HOLDINGS INC.(E); BROOKFIELD CORPORATION(E); HOLDINGS LLC(E); BROOKFIELD US INC.(E); ULC(E),True,PYMUPDF_ONLY,,,,,45,0,0,0,BROOKFIELD GLOBAL SUBINVESTMENTS LIMITED; BPGH NEW SUBCO INC.; BROOKFIELD GP (AUSTRALIA) INC.,,35.0
285211,PINEBRIDGE INVESTMENTS LLC,71.09,timed_out,19,9,"PINEBRIDGE INVESTMENTS HOLDINGS US LLC(E); HOLDINGS, LLC(E); METLIFE, INC.(E); HOLDINGS US LLC(E); METLIFE INVESTMENT MANAGEMENT(E)",True,PYMUPDF_ONLY,,,,,4,0,0,0,"METLIFE INVESTMENT MANAGEMENT HOLDINGS, LLC; METLIFE, INC.; PINEBRIDGE INVESTMENTS HOLDINGS US LLC",,18.7
6210,WILSHIRE,99.1,timed_out,45,19,"MONICA HOLDCO (US) INC.(E); MONICA GUARANTOR, LP(E); MONICA INTERMEDIATE, LP(E); MONICA HOLDINGS (JERSEY), LP(E); MONICA HOLDINGS (JERSEY), LP(E)",True,PYMUPDF_ONLY,,,,,15,0,0,0,"MONICA HOLDCO (US) INC.; CC MONICA HOLDINGS, LLC; CC-SGG MONICA AGGREGATOR, LLC",,23.2
117050,MORGAN STANLEY AIP GP LP,38.67,timed_out,7,5,"INVESTMENTS LLC(NA); MANAGEMENT INC.(E); MANAGEMENT INC.(E); MORGAN STANLEY(E); MANAGMENT, LLC(E)",True,PYMUPDF_ONLY,,,,,4,0,0,0,MANAGEMENT INC.; MORGAN STANLEY ALTERNATIVE INVESTMENTS LLC; MORGAN STANLEY,,29.9
171207,"BROOKFIELD ASSET MANAGEMENT PIC ADVISER (PRIVATE EQUITY), L.P.",72.93,timed_out,19,6,BROOKFIELD PE GP ULC(NA); BPEG MANAGER HOLDINGS LP(E); BROOKFIELD ASSET MANAGEMENT ULC(E); BROOKFIELD CORPORATION(D); BROOKFIELD ASSET MANAGEMENT LTD(C),True,PYMUPDF_ONLY,,,,,5,0,0,0,BROOKFIELD ASSET MANAGEMENT LTD; BROOKFIELD PE GP ULC; BROOKFIELD CORPORATION,,34.2
106006,BARINGS LLC,345.21,timed_out,20,3,INSURANCE COMPANY(E); MASSMUTUAL HOLDING LLC(E); HOLDING LLC(E),False,PYMUPDF_ONLY,,,,,3,0,0,0,MM ASSET MANAGEMENT HOLDING LLC; INSURANCE COMPANY; MASSMUTUAL HOLDING LLC,,20.6
155317,THE BOLLARD GROUP LLC,6.78,timed_out,23,4,TRUST DATED 4/20/2018(A); PROFESTA TRUST(C); TRUST DATED 4/20/2018(NA); MACINTOSH II LLC(C),False,PYMUPDF_ONLY,,,,,3,0,0,0,PROFESTA TRUST; MICHAEL WHEELER LIVING TRUST DATED 4/20/2018; MACINTOSH II LLC,,17.8
107913,SCULPTOR CAPITAL LP,44.26,timed_out,49,23,"CORPORATION(NA); CALDER HOLDCO I LP(E); MANAGEMENT, INC.(E); RITHM CAPITAL CORP.(E); SCULPTOR CAPITAL LP(E)",True,PYMUPDF_ONLY,,,,,10,0,0,0,CALDER HOLDCO I LP; HOLDING CORPORATION; SCULPTOR LOAN MANAGEMENT LLC,,26.9
108069,"BLACKROCK CAPITAL MANAGEMENT, INC.",134.71,timed_out,16,7,"BLACKROCK ADVISORS, LLC(E); BLACKROCK FINANCE, INC.(E); BLACKROCK HOLDCO 2, INC.(E); BLACKROCK CAPITAL HOLDINGS, INC.(E); BLACKROCK FINANCIAL MANAGEMENT, INC(E)",True,PYMUPDF_ONLY,,,,,7,0,0,0,"BLACKROCK CAPITAL HOLDINGS, INC.; BLACKROCK FINANCIAL MANAGEMENT, INC; BLACKROCK FINANCE, INC.",,15.9
143635,STEPSTONE GROUP LP,95.63,timed_out,10,3,STEPSTONE GROUP HOLDINGS LLC(NA); STEPSTONE GROUP INC.(D); STEPSTONE GROUP INC.(E),True,PYMUPDF_ONLY,,,,,2,0,0,0,STEPSTONE GROUP INC.; STEPSTONE GROUP HOLDINGS LLC,,84.3
290336,"BLACKROCK CAPITAL INVESTMENT ADVISORS, LLC",39.21,timed_out,8,6,"BLACKROCK ADVISORS, LLC(E); BLACKROCK FINANCE, INC.(E); BLACKROCK HOLDCO 2, INC.(E); BLACKROCK CAPITAL HOLDINGS, INC.(E); BLACKROCK, INC.(E)",True,PYMUPDF_ONLY,,,,,7,0,0,0,"BLACKROCK CAPITAL HOLDINGS, INC.; BLACKROCK FINANCIAL MANAGEMENT, INC; BLACKROCK FINANCE, INC.",,41.9
157920,"CLEARLAKE CAPITAL GROUP, L.P.",79.58,timed_out,132,45,"CLEARLAKE CAPITAL GROUP GP,(NA); CCG OPERATIONS, LLC(E); CCG GLOBAL, LLC(E); HOLDINGS, L.P.(E); CCG OPERATIONS, LLC(D)",True,PYMUPDF_ONLY,,,,,14,0,0,0,"CCG MEMBERCO LIMITED; CLEARLAKE CAPITAL PARENT HOLDINGS, L.P.; CLEARLAKE CAPITAL GROUP, L.P.",,26.0
124612,BROWN ADVISORY INVESTMENT SOLUTIONS GROUP LLC,8.45,timed_out,16,4,BROWN ADVISORY MANAGEMENT LLC(E); HOLDINGS LLC(C); MANAGEMENT LLC(E); HOLDINGS LLC(C),True,PYMUPDF_ONLY,,,,,3,0,0,0,BROWN ADVISORY GROUP HOLDINGS LLC; BROWN ADVISORY MANAGEMENT LLC; MANAGEMENT LLC,,73.0
